"SCRIPTID","NAME","USERID","CREATEDATE","DATEOFMODIFIED","RELEASE","CATEGORY","DETAILS","MODULE","REPOSITORY","DESIGNER","SYSCODE","HOSTNAME","REVIEWER","REVIEW_STARTDATE","REVIEW_ENDDATE","ACTIVEX"
1168,"FT_SOE_Resh2.1","SS7654321","01/02/2020","2020/02/01 23:58:54","9.2","Trash","resr2","SOE","C:\ScriptBuilderRepo\Functional Test","SS7654321","01","0","","7-4-2021","","false"
1163,"FT_SOE_Resh1","SS7654321","01/02/2020","2020/02/01 23:33:00","9.2","Trash","ds","SOE","C:\ScriptBuilderRepo\Functional Test","SS7654321","01","0","","","","false"
1161,"FT_SOE_ST4","SS7654321","01/02/2020","2020/02/01 23:29:00","9.2","Trash","Resh1","SOE","C:\ScriptBuilderRepo\Functional Test","SS7654321","01","0","","7-4-2021","","false"
1158,"FT_SOE_FT1","SS7654321","01/02/2020","2020/02/01 23:02:37","9.2","Trash","PO","SOE","C:\ScriptBuilderRepo\Functional Test","SS7654321","01","0","","7-4-2021","","false"
1155,"FT_SOE_ST3","SS7654321","01/02/2020","2020/02/01 22:49:21","9.2","Trash","PO","SOE","C:\ScriptBuilderRepo\Functional Test","SS7654321","03B","0","","7-4-2021","","false"
1154,"FT_SOE_ST2","SS7654321","01/02/2020","2020/02/01 22:43:37","9.2","Trash","ST2","SOE","C:\ScriptBuilderRepo\Functional Test","SS7654321","03B","0","","","","false"
1153,"FT_SOE_ST1","SS7654321","01/02/2020","2020/02/01 22:38:43","9.2","Trash","ST1","SOE","C:\ScriptBuilderRepo\Functional Test","SS7654321","01","0","","","","false"
1166,"FT_SOE_Resh1.2","SS7654321","01/02/2020","2020/02/01 23:39:52","9.2","Trash","fdf","SOE","C:\ScriptBuilderRepo\Functional Test","SS7654321","01","0","","16-4-2021","","false"
1165,"FT_SOE_Resh1.1","SS7654321","01/02/2020","2020/02/01 23:38:59","9.2","Trash","ds","SOE","C:\ScriptBuilderRepo\Functional Test","SS7654321","01","0","","","","false"
5738,"SS_UAT011","SS7654321","01/02/2021","2021/02/01 04:54:49","9.2","Trash","das","FMS","AutHubRepo\EOne\9.2\Trash","SS7654321","12","0","","","","false"
5734,"FT_CRM_CAM_Issue Type  Code","IC8867899","01/02/2021","","9.2","FT","Script verifies UDCs for Equipment","CRM","AutHubRepo\EOne\9.2\FT","AP9076327","13","0","","","","false"
5737,"SS_P01","SS7654321","01/02/2021","2021/02/01 04:46:09","9.2","Trash","cz","FMS","AutHubRepo\EOne\9.2\Trash","SS7654321","12","0","","","","false"
5736,"SS_TT1","SS7654321","01/02/2021","2021/02/01 04:42:14","9.2","Trash","da","FMS","AutHubRepo\EOne\9.2\Trash","SS7654321","12","0","VK9076634","14-6-2021","06/14/2021","false"
5735,"SS_SIGNINTEST_01","SS7654321","01/02/2021","2021/02/01 02:27:34","9.2","Trash","das","FMS","AutHubRepo\EOne\9.2\Trash","SS7654321","12","0","","","","false"
6765,"FMS_DataProtection_BankAccountNumber-Copy(2)","PP9077311","01/02/2022","","9.2","BPF","This script verifies that account number related info is masked by default and upon entering exceptions in P0040, account number related info will be unmasked.","FMS","AutHubRepo\EOne\9.2\BPF","YP9073708","04","0","","","","false"
6763,"CRM_testscript-Copy","PP9077311","01/02/2022","","9.2","BPF","testscript","CRM","AutHubRepo\EOne\9.2\BPF","RR9076538","05A","0","","","","false"
6764,"HCM_ESS_OPEN_ENROLLMENT-Copy(1)","PP9077311","01/02/2022","","9.2","BPF","Employee Self Service in Open Enrollment.","HCM","AutHubRepo\EOne\9.2\BPF","PY9072027","08B","0","","","","false"
1550,"FT_SOE_SS_UAT_VISA3","SS7654321","01/03/2020","2020/03/01 19:00:48","9.2","Trash","re","SOE","\\den01ccp.us.oracle.com\NewScriptBuilderRepo\EOne\9.2\Trash","SS7654321","00","0","","","","false"
6817,"FT_HCM_33369593_BUG_TESTING","BV9077354","01/03/2022","2022/03/01 04:23:38","9.2","Trash","","HCM","AutHubRepo\EOne\9.2\Trash","BV9077354","07","0","","","","false"
7622,"FT_SOE_LocationHold_SO","SS9070540","01/03/2023","2023/03/01 10:25:03","9.2","FT","","SOE","AutHubRepo\EOne\9.2\FT","SS9070540","42","0","IC8823870","29-3-2023","04/27/2023","false"
1821,"FT_SOE_SS_A16","SS7654321","01/04/2020","2020/04/01 23:22:44","9.2","Trash","efdfd","SOE","\\den01ccp.us.oracle.com\NewScriptBuilderRepo\EOne\9.2\Trash","SS7654321","00","0","VK9076634","14-6-2021","06/14/2021","false"
1819,"FT_SOE_SS_A15","SS7654321","01/04/2020","2020/04/01 22:53:17","9.2","Trash","ghgh","SOE","\\den01ccp.us.oracle.com\NewScriptBuilderRepo\EOne\9.2\Trash","SS7654321","00","0","","","","false"
1817,"FT_SOE_SS_A14","SS7654321","01/04/2020","2020/04/01 22:14:44","9.2","Trash","fdfd","SOE","\\den01ccp.us.oracle.com\NewScriptBuilderRepo\EOne\9.2\Trash","SS7654321","00","0","","","","false"
1816,"FT_SOE_SS_A13","SS7654321","01/04/2020","2020/04/01 22:08:16","9.2","Trash","fdfd","SOE","\\den01ccp.us.oracle.com\NewScriptBuilderRepo\EOne\9.2\Trash","SS7654321","00","0","","","","false"
1815,"FT_SOE_SS_A12","SS7654321","01/04/2020","2020/04/01 21:57:24","9.2","Trash","ds","SOE","\\den01ccp.us.oracle.com\NewScriptBuilderRepo\EOne\9.2\Trash","SS7654321","00","0","","","","false"
1814,"FT_SOE_SS_A11","SS7654321","01/04/2020","2020/04/01 21:41:29","9.2","Trash","dss","SOE","\\den01ccp.us.oracle.com\NewScriptBuilderRepo\EOne\9.2\Trash","SS7654321","00","0","","","","false"
1811,"FT_SOE_SS_REG_QBE_SEARCH1","SS7654321","01/04/2020","2020/04/01 04:04:39","9.2","Trash","ncc","SOE","\\den01ccp.us.oracle.com\NewScriptBuilderRepo\EOne\9.2\Trash","SS7654321","00","0","","","","false"
1810,"FT_SOE_SS_QBESCR1","SS7654321","01/04/2020","2020/04/01 03:42:16","9.2","Trash","ddfd","SOE","\\den01ccp.us.oracle.com\NewScriptBuilderRepo\EOne\9.2\Trash","SS7654321","00","0","","","","false"
1809,"FT_SOE_SS_REGR11","SS7654321","01/04/2020","2020/04/01 02:34:59","9.2","Trash","ffsfs","SOE","\\den01ccp.us.oracle.com\NewScriptBuilderRepo\EOne\9.2\Trash","SS7654321","00","0","","","","false"
1808,"FT_SRM_SS_REG11","SS7654321","01/04/2020","2020/04/01 02:10:23","9.2","Trash","ds","SRM","\\den01ccp.us.oracle.com\NewScriptBuilderRepo\EOne\9.2\Trash","SS7654321","00","0","","","","false"
1807,"FT_SOE_SS_REG_APR1","SS7654321","01/04/2020","2020/04/01 01:40:15","9.2","Trash","fhf","SOE","\\den01ccp.us.oracle.com\NewScriptBuilderRepo\EOne\9.2\Trash","SS7654321","00","0","","","","false"
1806,"FT_SOE_SS_REG11","SS7654321","01/04/2020","2020/04/01 01:38:47","9.2","Trash","sdsds","SOE","\\den01ccp.us.oracle.com\NewScriptBuilderRepo\EOne\9.2\Trash","SS7654321","00","0","","","","false"
5901,"SmokeTest","VK9076634","01/04/2021","2021/04/01 00:37:16","9.2","Trash","Smoke test","SRM","AutHubRepo\EOne\9.2\Trash","VK9076634","00","0","VK9076634","6-5-2021","06/14/2021","false"
5902,"crm_case_01","RR9076538","01/04/2021","2021/04/01 01:26:39","9.2","Trash","jj","CRM","AutHubRepo\EOne\9.2\Trash","RR9076538","09","0","","","","false"
6875,"FT_SOE_InvConsolidationONSameCompany","IC9016551","01/04/2022","2022/04/01 01:28:15","9.2","FT","BUG33488521<br>Output of R42565 Print Invoice has to display total Invoice (Summary) even if Invoice consolidation flag is activated in Billing Information for the customer.","SOE","AutHubRepo\EOne\9.2\FT","IC9016551","42","0","","","","false"
6876,"FT_SOE_InvConsolidationONDiffCompany","IC9016551","01/04/2022","","9.2","FT","BUG33488521<br>Output of R42565 Print Invoice has to display total Invoice (Summary) even if Invoice consolidation flag is activated in Billing Information for the customer.","SOE","AutHubRepo\EOne\9.2\FT","IC9016551","42","0","FQ1234567","10/04/2022","10/04/2022","false"
2650,"FT_SOE_SS_0980","SS7654321","01/05/2020","2020/05/01 09:31:19","9.2","Trash","gj","SOE","AutHubRepo\EOne\9.2\Trash","SS7654321","00","0","","","","false"
2651,"FT_SOE_SSA_0","SS7654321","01/05/2020","2020/05/01 09:50:36","9.2","Trash","dsds","SOE","AutHubRepo\EOne\9.2\Trash","SS7654321","00","0","","","","false"
2652,"FT_SOE_SS_09808","SS7654321","01/05/2020","2020/05/01 10:10:07","9.2","Trash","dds","SOE","AutHubRepo\EOne\9.2\Trash","SS7654321","00","0","","","","false"
2653,"FT_SOE_SS_01M_983","SS7654321","01/05/2020","2020/05/01 10:27:15","9.2","Trash","sdds","SOE","AutHubRepo\EOne\9.2\Trash","SS7654321","03B","0","","","","false"
2654,"FT_SOE_SS_8794","SS7654321","01/05/2020","2020/05/01 10:37:46","9.2","Trash","sdsd","SOE","AutHubRepo\EOne\9.2\Trash","SS7654321","00","0","","","","false"
2655,"FT_SOE_SS_01M_986","SS7654321","01/05/2020","2020/05/01 10:49:31","9.2","Trash","sdas","SOE","AutHubRepo\EOne\9.2\Trash","SS7654321","00","0","","","","false"
2656,"FT_SOE_SS_9ips","SS7654321","01/05/2020","2020/05/01 11:08:07","9.2","Trash","sds","SOE","AutHubRepo\EOne\9.2\Trash","SS7654321","00","0","","","","false"
2657,"FT_SOE_SS_09_POI","SS7654321","01/05/2020","2020/05/01 11:25:53","9.2","Trash","sdsd","SOE","AutHubRepo\EOne\9.2\Trash","SS7654321","00","0","","","","false"
2632,"FT_SOE_SS_GRIDREF_MOUSE_01","SS7654321","01/05/2020","2020/04/30 20:41:55","9.2","Trash","sdsd","SOE","AutHubRepo\EOne\9.2\Trash","SS7654321","01","0","","","","false"
2633,"FT_SOE_SS_GRIDREF_MOUSE_02","SS7654321","01/05/2020","2020/04/30 20:45:36","9.2","Trash","ssds","SOE","AutHubRepo\EOne\9.2\Trash","SS7654321","00","0","","","","false"
2634,"FT_SOE_SS_GRIDREF_MOUSE03","SS7654321","01/05/2020","2020/04/30 21:08:44","9.2","Trash","sds","SOE","AutHubRepo\EOne\9.2\Trash","SS7654321","01","0","","","","false"
2635,"FT_SOE_SS_QBESCROLL_0909","SS7654321","01/05/2020","2020/04/30 21:18:51","9.2","Trash","ds","SOE","AutHubRepo\EOne\9.2\Trash","SS7654321","00","0","","","","false"
2636,"FT_SOE_SS-FREG_012","SS7654321","01/05/2020","2020/04/30 21:36:37","9.2","Trash","sds","SOE","AutHubRepo\EOne\9.2\Trash","SS7654321","00","0","","","","false"
2637,"FT_SOE_SS_FRM_090","SS7654321","01/05/2020","2020/04/30 22:39:08","9.2","Trash","dsad","SOE","AutHubRepo\EOne\9.2\Trash","SS7654321","01","0","","","","false"
2638,"FT_SOE_Ss_FRM_090","SS7654321","01/05/2020","2020/04/30 23:12:34","9.2","Trash","sds","SOE","AutHubRepo\EOne\9.2\Trash","SS7654321","00","0","","","","false"
2639,"FT_SOE_FRM_09","SS7654321","01/05/2020","2020/04/30 23:24:57","9.2","Trash","j","SOE","AutHubRepo\EOne\9.2\Trash","SS7654321","00","0","","","","false"
2640,"FT_SOE_SS_FORMCHECK_01M_01","SS7654321","01/05/2020","2020/05/01 06:52:36","9.2","Trash","dssds","SOE","AutHubRepo\EOne\9.2\Trash","SS7654321","01","0","","","","false"
2641,"FT_SOE_SS_FR_01M_02","SS7654321","01/05/2020","2020/05/01 07:07:42","9.2","Trash","sdsd","SOE","AutHubRepo\EOne\9.2\Trash","SS7654321","00","0","","","","false"
2642,"FT_SOE_SS_01M_01","SS7654321","01/05/2020","2020/05/01 07:39:14","9.2","Trash","sds","SOE","AutHubRepo\EOne\9.2\Trash","SS7654321","00","0","","","","false"
2643,"FT_SOE_SS_01M_03_GREF","SS7654321","01/05/2020","2020/05/01 08:20:25","9.2","Trash","dsd","SOE","AutHubRepo\EOne\9.2\Trash","SS7654321","00","0","","","","false"
2644,"FT_SOE_SS_01M_04_GREF","SS7654321","01/05/2020","2020/05/01 08:32:48","9.2","Trash","sds","SOE","AutHubRepo\EOne\9.2\Trash","SS7654321","00","0","","","","false"
2645,"FT_SOE_SS_01_M_BRNI01","SS7654321","01/05/2020","2020/05/01 08:39:34","9.2","Trash","ds","SOE","AutHubRepo\EOne\9.2\Trash","SS7654321","03B","0","","","","false"
2646,"FT_SOE_SS_01M_BRNI03_04","SS7654321","01/05/2020","2020/05/01 08:54:08","9.2","Trash","dss","SOE","AutHubRepo\EOne\9.2\Trash","SS7654321","00","0","","","","false"
2647,"FT_SOE_SS_01M_BRNI_06","SS7654321","01/05/2020","2020/05/01 08:59:00","9.2","Trash","dsd","SOE","AutHubRepo\EOne\9.2\Trash","SS7654321","00","0","","","","false"
2648,"FT_SOE_SS_01M_BRNI07","SS7654321","01/05/2020","2020/05/01 09:08:44","9.2","Trash","dsd","SOE","AutHubRepo\EOne\9.2\Trash","SS7654321","03B","0","","","","false"
2649,"FT_SOE_SS_01M_BRNi_08","SS7654321","01/05/2020","2020/05/01 09:16:35","9.2","Trash","adsd","SOE","AutHubRepo\EOne\9.2\Trash","SS7654321","01","0","","","","false"
3122,"SS_KIAS_01J_03","SS7654321","01/06/2020","2020/05/31 20:39:46","9.2","Trash","dsds","SOE","AutHubRepo\EOne\9.2\Trash","SS7654321","00","0","","","","false"
3125,"SS-BRMI_RECIPT_1","SS7654321","01/06/2020","2020/05/31 22:03:37","9.2","Trash","dsds","SOE","AutHubRepo\EOne\9.2\Trash","SS7654321","00","0","","","","false"
3120,"SS_KIAS_01J_01","SS7654321","01/06/2020","2020/05/31 20:03:38","9.2","Trash","cdcd","SOE","AutHubRepo\EOne\9.2\Trash","SS7654321","00","0","","","","false"
3146,"KrishTestRec_01","VK9076634","01/06/2020","2020/06/01 08:39:15","9.2","Trash","Testing recorder","SRM","AutHubRepo\EOne\9.2\Trash","VK9076634","01","0","","","","false"
3145,"CASETest","VK9076634","01/06/2020","2020/06/01 08:37:15","9.2","Trash","Testing recorder","SRM","AutHubRepo\EOne\9.2\Trash","VK9076634","01","0","","","","false"
3144,"SS_Kias_Form_01","SS7654321","01/06/2020","2020/06/01 08:04:54","9.2","Trash","dsad","SOE","AutHubRepo\EOne\9.2\Trash","SS7654321","00","0","","","","false"
3143,"SS_Khias1_Tree01","SS7654321","01/06/2020","2020/06/01 07:53:22","9.2","Trash","cvv","SOE","AutHubRepo\EOne\9.2\Trash","SS7654321","00","0","","","","false"
3140,"SS_SOW_02","SS7654321","01/06/2020","2020/06/01 07:18:36","9.2","Trash","sds","SOE","AutHubRepo\EOne\9.2\Trash","SS7654321","00","0","","","","false"
3139,"SS_SW_01","SS7654321","01/06/2020","2020/06/01 07:08:11","9.2","Trash","ds","SOE","AutHubRepo\EOne\9.2\Trash","SS7654321","01","0","","","","false"
3138,"SS_Sow_LoginIssue_01","SS7654321","01/06/2020","2020/06/01 06:57:55","9.2","Trash","sds","SOE","AutHubRepo\EOne\9.2\Trash","SS7654321","00","0","","","","false"
3135,"SS_CommaTest_Khias_01","SS7654321","01/06/2020","2020/06/01 03:31:33","9.2","Trash","dfd","SOE","AutHubRepo\EOne\9.2\Trash","SS7654321","00","0","","","","false"
3133,"FT_MFG_Activate_Quality_Module","RD9076642","01/06/2020","2020/06/01 03:11:35","9.2","Trash","","MFG","AutHubRepo\EOne\9.2\Trash","RD9076642","03B","0","","","","false"
3131,"SS_BlanketOrder_02","SS7654321","01/06/2020","2020/06/01 02:23:07","9.2","Trash","dsd","SOE","AutHubRepo\EOne\9.2\Trash","SS7654321","03B","0","","","","false"
3129,"FT_FMS_JC_Pro","RA9076651","01/06/2020","2020/06/01 02:02:54","9.2","Trash","Test JC  Pro","FMS","AutHubRepo\EOne\9.2\Trash","RA9076651","03B","0","","","","false"
3128,"SS_BRNI_BlanketOrder_01","SS7654321","01/06/2020","2020/06/01 01:55:29","9.2","Trash","ds","SOE","AutHubRepo\EOne\9.2\Trash","SS7654321","03B","0","","","","false"
3126,"SS_BRNI_03","SS7654321","01/06/2020","2020/05/31 22:10:48","9.2","Trash","ds","SOE","AutHubRepo\EOne\9.2\Trash","SS7654321","00","0","","","","false"
3123,"SS_KIAS_01J_06","SS7654321","01/06/2020","2020/05/31 20:58:26","9.2","Trash","dsd","SOE","AutHubRepo\EOne\9.2\Trash","SS7654321","00","0","","","","false"
3124,"SS_BRNI_01J_01_OUOTEORDER","SS7654321","01/06/2020","2020/05/31 21:47:25","9.2","Trash","sds","SOE","AutHubRepo\EOne\9.2\Trash","SS7654321","00","0","","","","false"
3121,"SS_KIAS_01J_02","SS7654321","01/06/2020","2020/05/31 20:08:57","9.2","Trash","fds","SOE","AutHubRepo\EOne\9.2\Trash","SS7654321","00","0","","","","false"
7972,"FT_HCM_BUG_34676197_SUPP_BEN_TESTCASE_1TO3-Copy","BV9077354","01/06/2023","","9.2","FT","EE 34676197, has taxable benefit for $1000. Script will run interim for 3 cases:<br>case 1:<br>with pay type 500 penny in and out. Verify tax amounts.<br>case 2:<br>with pay type 1 penny in and out. Verify tax amounts.<br>case 1:<br>with pay type 500 penny in and out. Verify tax amounts.<br>with pay type 1 penny in and out. Verify tax amounts.","HCM","AutHubRepo\EOne\9.2\FT","BV9077354","07","0","","","","false"
7976,"FT_HCM_Bug_32614786_ASec_Testing","BV9077354","01/06/2023","2023/06/01 23:28:00","9.2","FT","BUG 32614786 - DBA AMOUNT INCORRECTLY CALCULATING AS GROSS PAY FOR TABLE CODE DBAS","HCM","AutHubRepo\EOne\9.2\FT","BV9077354","07","0","","","","false"
3733,"example1","BP9077063","01/07/2020","2020/07/01 08:37:53","9.2","Trash","","CRM","AutHubRepo\EOne\9.2\Trash","BP9077063","00","0","","","","false"
3736,"GroupingTest","VK9076634","01/07/2020","2020/07/01 22:34:18","9.2","Trash","Test","SRM","AutHubRepo\EOne\9.2\Trash","VK9076634","00","0","","","","false"
3730,"P4310-Copy","VK9076634","01/07/2020","","9.2","Trash","","SRM","AutHubRepo\EOne\9.2\Trash","PS9074823","43","0","","","","false"
3729,"SS_TEST01_02","SS7654321","01/07/2020","2020/06/30 23:35:13","9.2","Trash","sds","SOE","AutHubRepo\EOne\9.2\Trash","SS7654321","12","0","","","","false"
3728,"SS_TEST01_01","SS7654321","01/07/2020","2020/06/30 22:21:57","9.2","Trash","dss","SOE","AutHubRepo\EOne\9.2\Trash","SS7654321","12","0","","","","false"
3731,"FT_SOE_SO_Create","SS7654321","01/07/2020","2020/07/01 05:09:17","9.2","Trash","Create SO","SOE","AutHubRepo\EOne\9.2\Trash","SS7654321","42","0","","","","false"
3734,"RPT","PS9074823","01/07/2020","2020/07/01 08:38:22","9.2","Trash","","SRM","AutHubRepo\EOne\9.2\Trash","PS9074823","43","0","","","","false"
7053,"Test5678","SP9077688","01/07/2022","2022/07/01 05:27:49","9.2","Trash","","CRM","AutHubRepo\EOne\9.2\Trash","SP9077688","01","0","","","","false"
8308,"SS_ORC_02AUG_01-Mukesh_Copy","MY9077944","01/08/2023","","9.2","Trash","Orc Test","FMS","AutHubRepo\EOne\9.2\Trash","SS7654321","01","0","","","","false"
8309,"SS_ORC_02AUG_01-Biplab","BM9077371","01/08/2023","","9.2","Trash","Orc Test","FMS","AutHubRepo\EOne\9.2\Trash","SS7654321","01","0","","","","false"
8312,"SS_ORC_02AUG_01-Copy(1)","SR9078040","01/08/2023","","9.2","Trash","Orc Test","FMS","AutHubRepo\EOne\9.2\Trash","SS7654321","01","0","","","","false"
8313,"SS_ORC_02AUG_01-Sai_Copy","JS9078103","01/08/2023","","9.2","Trash","Orc Test","FMS","AutHubRepo\EOne\9.2\Trash","SS7654321","01","0","","","","false"
8318,"ST_ORC_02AUG_01","JS9078103","01/08/2023","2023/08/01 22:37:01","9.2","Trash","","MFG","AutHubRepo\EOne\9.2\Trash","JS9078103","12","1","","","","false"
8324,"Orchestrator_Aug_2nd","BM9077371","01/08/2023","2023/08/01 23:04:10","9.2","Trash","","FMS","AutHubRepo\EOne\9.2\Trash","BM9077371","00","0","","","","false"
8323,"ORC_2AUG_TEST_1","MY9077944","01/08/2023","2023/08/01 22:50:23","9.2","Trash","","FMS","AutHubRepo\EOne\9.2\Trash","MY9077944","00","1","","","","false"
8321,"SS_ORC_02AUG_01-PG","PG9076925","01/08/2023","","9.2","Trash","Orc Test","FMS","AutHubRepo\EOne\9.2\Trash","SS7654321","01","0","","","","false"
8299,"FMS_OrchestratorDemo_Script2","SR9078040","01/08/2023","2023/08/01 00:13:20","9.2","BPF","","FMS","AutHubRepo\EOne\9.2\BPF","SR9078040","43A","0","","","","false"
8300,"FT_MFG_MRP_38064_FT1","MR9077039","01/08/2023","","9.2","FT","MRP_38064_FT1","MFG","AutHubRepo\EOne\9.2\FT","MR9077039","34","0","SR9078040","10-5-2024","","false"
8315,"ORC_2Aug_Test","MY9077944","01/08/2023","2023/08/01 22:19:37","9.2","Trash","","FMS","AutHubRepo\EOne\9.2\Trash","MY9077944","01","1","","","","false"
4749,"FT_HCM_Run Multi Version payroll steps","AA9055665","01/09/2020","2020/09/01 11:38:22","9.2","Trash","Run Payroll steps separately","HCM","AutHubRepo\EOne\9.2\Trash","AA9055665","07","0","","","","false"
4748,"FT_SOE_gross Profit Margin Advance Preference","SP9073695","01/09/2020","2020/09/01 11:24:32","9.2","FT","Verify the Gross profit margin Advance preference in P4210 in Add update and copy mode
item QA600, customer 9669, QAPROFIT  is the preference schedule and Gprofit is the Adjustment Schedule  ","SOE","AutHubRepo\EOne\9.2\FT","SP9073695","45","0","CS9076571","18-5-2021","08/31/2021","false"
4747,"FT_SRM_Amt.Level adjustment with blank reprice group, Auto reprice ON","PS9074823","01/09/2020","","9.2","FT","","SRM","AutHubRepo\EOne\9.2\FT","PS9074823","43","0","","","07/29/2021","false"
4736,"FT_MFG_09Cost_UnderIssue_STDUpdateforL,M,S_ScrapYes_OverCompletion_MultipleWO","SL9077266","01/09/2020","","9.2","FT","Validate R31802A for Under Issue, Standard Time Update for labor, Machine and Setup, with Scrap and Over completions for 09 Cost","MFG","AutHubRepo\EOne\9.2\FT","SL9077266","31A","0","PG9076925","20-5-2021","08/31/2021","false"
4734,"FT_SRM_TestINQueue","VK9076634","01/09/2020","2020/09/01 05:13:09","9.2","Trash","FT_HCM_VERIFY_TAX_OVERRIDES_REG_SUPP_COMBINED_PAY","SRM","AutHubRepo\EOne\9.2\Trash","VK9076634","00","0","","","","false"
4737,"FT_HCM_STOP PLAN AND MISTAKEN ENROLLMENT","BV9077354","01/09/2020","2020/09/01 05:21:38","9.2","FT","","HCM","AutHubRepo\EOne\9.2\FT","BV9077354","08B","0","IC8823870","1-7-2021","08/09/2021","false"
4730,"FT_MFG_09Cost_UnderIssue_STDUpdateforL,M,S_ScrapNo_UnderCompletion_MultipleWO","SL9077266","01/09/2020","","9.2","FT","Validate R31802A for Under Issue, Standard Time Update for labor, Machine and Setup, without Scrap and under completions for 09 Cost","MFG","AutHubRepo\EOne\9.2\FT","SL9077266","31A","0","PG9076925","20-5-2021","08/31/2021","false"
4728,"FT_MFG_09Cost_UnderIssue_STDUpdateforL,M,S_ScrapYes_UnderCompletion_MultipleWO","SL9077266","01/09/2020","","9.2","FT","Validate R31802A for Under Issue, Standard Time Update for labor, Machine and Setup, with Scrap and under completions for 09 Cost","MFG","AutHubRepo\EOne\9.2\FT","SL9077266","31A","0","CS9076571","20-5-2021","08/31/2021","false"
4726,"FT_HCM_VERIFY_CANADIAN_TAX_EXEMPTIONS","IC8995276","01/09/2020","","9.2","FT","CA TX OD","HCM","AutHubRepo\EOne\9.2\FT","IC8995276","H90T","0","FQ1234567","12-9-2022","","false"
7176,"FT_SRM_P4314WB ATRL01 LV FEEINSERT F4311","IC8823790","01/09/2022","2022/08/31 23:41:18","9.2","FT","Invoice Fee match for rule 01 using SVPI and logged voucher. The fee line is inserted into F4311","SRM","AutHubRepo\EOne\9.2\FT","IC8823790","43B","0","MY9077944","11-10-2022","11/27/2022","false"
7178,"FT_FMS_JE with Subledger type W","IC9031954","01/09/2022","2022/09/01 02:19:08","9.2","FT","","FMS","AutHubRepo\EOne\9.2\FT","IC9031954","09","0","IC8823870","16-11-2022","11/23/2022","false"
7179,"FT_SRM_P4314WB 01 SVPIL LV FEE INSERT F4311","IC8823790","01/09/2022","2022/09/01 02:42:02","9.2","FT","Invoice fee match using SVPIL and Logged voucher. fee line is inserted into F4311","SRM","AutHubRepo\EOne\9.2\FT","IC8823790","43B","0","SD9077442","11-10-2022","03/02/2023","false"
8500,"FT_HCM_Payroll BUG35450608 Multistate1","PY9072027","01/09/2023","2023/09/01 03:00:16","9.2","Trash","This script includes the payroll data for the state Guam, Alabama and Delaware. It validates the gross pay, tax types and the tax amounts.","HCM","AutHubRepo\EOne\9.2\Trash","PY9072027","07","0","","","","false"
8499,"Orchtest_Sep1","SR9078040","01/09/2023","2023/09/01 01:53:31","9.2","Trash","","FMS","AutHubRepo\EOne\9.2\Trash","SR9078040","43C","0","","","","false"
8501,"FT_HCM_Payroll BUG35450608 Multistate2","PY9072027","01/09/2023","2023/09/01 03:03:54","9.2","Trash","This script is to validate the state New Jersey, North Carolina and PuertoRico employee's gross amounts, tax types and their tax amounts.","HCM","AutHubRepo\EOne\9.2\Trash","PY9072027","07","0","","","","false"
4944,"FT_FMS_JC_ProcessingOptions_P510171","VK9075359","01/10/2020","","9.2","FT","Script to set up processing options for P510171","FMS","AutHubRepo\EOne\9.2\FT","AP9076327","51","0","","","","false"
6643,"FT_FMS_JVM_R09J407_Create Voucher","IC8735933","01/10/2021","2021/10/01 04:44:41","9.2","FT","JVM Invoicing- create voucher","FMS","AutHubRepo\EOne\9.2\FT","IC8735933","09J","0","MO9077792","8-11-2021","02/08/2022","false"
6645,"FT_SRM_P43250-Retain Lot Grade From Lot Master=1","IC9016551","01/10/2021","2021/10/01 09:32:10","9.2","FT","","SRM","AutHubRepo\EOne\9.2\FT","IC9016551","43A","0","MO9077792","16-11-2021","02/01/2022","false"
5123,"FT_FMS_JC_ProcessingOptions_R51530","VK9075359","01/11/2020","","9.2","FT","Script to set up processing options for R51530","FMS","AutHubRepo\EOne\9.2\FT","AP9076327","51","0","","","","false"
5124,"FT_FMS_JC_ProcessingOptions_R51540","VK9075359","01/11/2020","","9.2","FT","Script to set up processing options for R51540","FMS","AutHubRepo\EOne\9.2\FT","AP9076327","51","0","","","","false"
5122,"FT_FMS_JC_ProcessingOptions_R51525","VK9075359","01/11/2020","","9.2","FT","Script to set up processing options for R51525","FMS","AutHubRepo\EOne\9.2\FT","AP9076327","51","0","","","","false"
5119,"FT_FMS_JC_ProcessingOptions_R51443","VK9075359","01/11/2020","","9.2","FT","Script to set up processing options for R51443","FMS","AutHubRepo\EOne\9.2\FT","AP9076327","51","0","","","","false"
5120,"FT_FMS_JC_ProcessingOptions_R51445","VK9075359","01/11/2020","","9.2","FT","Script to set up processing options for R51445","FMS","AutHubRepo\EOne\9.2\FT","AP9076327","51","0","","","","false"
5121,"FT_FMS_JC_ProcessingOptions_R51520","VK9075359","01/11/2020","","9.2","FT","Script to set up processing options for R51520","FMS","AutHubRepo\EOne\9.2\FT","AP9076327","51","0","","","","false"
5118,"FT_FMS_JC_ProcessingOptions_R51430","VK9075359","01/11/2020","","9.2","FT","Script to set up processing options for R51430","FMS","AutHubRepo\EOne\9.2\FT","AP9076327","51","0","","","","false"
5116,"FT_MFG_UnderIssue_OverTimeUpdateLMS_ScrapYes_NoCompl_MultipleWOs","PS9056588","01/11/2020","","9.2","FT","For  MFG WO,Perform Over issue, Enter std Time entry LMS,AddScrap,Add completion.Verify the values in P31022 Production cost inquiry.","MFG","AutHubRepo\EOne\9.2\FT","IC8871610","31A","0","SP9077688","28-6-2021","06/30/2021","false"
5114,"FT_MFG_UnderIssue_OverTimeUpdateLMS_ScrapYes_StdCompl_MultipleWOs","PS9056588","01/11/2020","","9.2","FT","For  MFG WO,Perform Over issue, Enter std Time entry LMS,AddScrap,Add completion.Verify the values in P31022 Production cost inquiry.","MFG","AutHubRepo\EOne\9.2\FT","IC8871610","31A","0","SP9077688","28-6-2021","08/31/2021","false"
5113,"FT_FMS_JC_ProcessingOptions_R51425B","VK9075359","01/11/2020","","9.2","FT","Script to set up processing options for R51425B","FMS","AutHubRepo\EOne\9.2\FT","AP9076327","51","0","","","","false"
5112,"FT_FMS_JC_ProcessingOptions_R51420","VK9075359","01/11/2020","","9.2","FT","Script to set up processing options for R51420","FMS","AutHubRepo\EOne\9.2\FT","AP9076327","51","0","","","","false"
5111,"FT_MFG_OverIssue_UnderTimeUpdateLMS_ScrapYes_OverCompl_MultipleWOs","PS9056588","01/11/2020","","9.2","FT","For  MFG WO,Perform Over issue, Enter std Time entry LMS,AddScrap,Add completion.Verify the values in P31022 Production cost inquiry.","MFG","AutHubRepo\EOne\9.2\FT","IC8871610","31A","0","SP9077688","22-6-2021","06/23/2021","false"
5110,"FT_MFG_OverIssue_UnderTimeUpdateLMS_ScrapYes_StdCompl_MultipleWOs","PS9056588","01/11/2020","","9.2","Trash","For  MFG WO,Perform Over issue, Enter std Time entry LMS,AddScrap,Add completion.Verify the values in P31022 Production cost inquiry.","MFG","AutHubRepo\EOne\9.2\Trash","IC8871610","31A","0","","","","false"
5109,"FT_MFG_OverIssue_UnderTimeUpdateLMS_ScrapNo_UnderCompl_MultipleWO","PS9056588","01/11/2020","","9.2","FT","For  MFG WO,Perform Over issue, Enter std Time entry LMS,AddScrap,Add completion.Verify the values in P31022 Production cost inquiry.","MFG","AutHubRepo\EOne\9.2\FT","IC8871610","31A","0","BM9077371","22-6-2021","08/31/2021","false"
5108,"FT_MFG_OverIssue_UnderTimeUpdateLMS_NoScrap_NoCompl_MultipleWOs","PS9056588","01/11/2020","","9.2","FT","For MFG WO, perform Under Issue. Enter under time entry for LMS. No scrap. No completion.","MFG","AutHubRepo\EOne\9.2\FT","IC8871610","31A","0","FQ1234567","04/30/2021","04/30/2021","false"
5107,"FT_MFG_OverIssue_UnderTimeUpdateLMS_ScrapNo_OverCompl_MultipleWO","PS9056588","01/11/2020","","9.2","FT","For  MFG WO,Perform Over issue, Enter std Time entry LMS,AddScrap,Add completion.Verify the values in P31022 Production cost inquiry.","MFG","AutHubRepo\EOne\9.2\FT","IC8871610","31A","0","BM9077371","22-6-2021","08/31/2021","false"
5106,"FT_MFG_OverIssue_UnderTimeUpdateLMS_ScrapNo_StdCompl_MultipleWO","PS9056588","01/11/2020","","9.2","Trash","For  MFG WO,Perform Over issue, Enter std Time entry LMS,AddScrap,Add completion.Verify the values in P31022 Production cost inquiry.","MFG","AutHubRepo\EOne\9.2\Trash","IC8871610","31A","0","","","","false"
8686,"FT_SOE_LocationHold_ST-enter","PG9076925","01/11/2023","","9.2","FT","","SOE","AutHubRepo\EOne\9.2\FT","SS9070540","42","0","","","","false"
5419,"FT_SRM_PO_Add_SingleLn_Dom_JSBLnTy_CTax_AccDist-Copy","SS7654321","01/12/2020","","9.2","Trash","","SRM","AutHubRepo\EOne\9.2\Trash","PS9074823","43","0","","","","false"
5418,"FT_MFG_R31804_STDIssue_STDUpdateforL,M,S_ScrapNo_NoCompletion_MultipleWO","SL9077266","01/12/2020","","9.2","FT","Validate R31804 for standard Issue, Standard Time Update for labor, Machine and Setup, without Scrap and No completions","MFG","AutHubRepo\EOne\9.2\FT","SL9077266","31A","0","IC8823870","29-6-2021","08/31/2021","false"
5412,"FT_MFG_R31804_STDIssue_STDUpdateforL,M,S_ScrapNo_UnderCompletion_MultipleWO","SL9077266","01/12/2020","","9.2","FT","Validate R31804 for standard Issue, Standard Time Update for labor, Machine and Setup, without Scrap and under completions","MFG","AutHubRepo\EOne\9.2\FT","SL9077266","31A","0","IC8823870","29-6-2021","08/31/2021","false"
5416,"FT_MFG_UnderIssue_StdTimeUpdateLMS_ScrapYes_OverCompl_MultipleWOs-Copy","IC8871610","01/12/2020","","9.2","Trash","For  MFG WO,Perform Over issue, Enter std Time entry LMS,AddScrap,Add completion.Verify the values in P31022 Production cost inquiry.","MFG","AutHubRepo\EOne\9.2\Trash","IC8871610","31A","0","","","","false"
5415,"HCM_ESS MARRIAGE EVENT","BV9077354","01/12/2020","2020/12/01 05:21:40","9.2","Trash","ESS MARRIAGE EVENT","HCM","AutHubRepo\EOne\9.2\Trash","BV9077354","08B","0","","","","false"
5414,"TA_demo","TA9077522","01/12/2020","2020/12/01 03:08:52","9.2","Trash","","SRM","AutHubRepo\EOne\9.2\Trash","TA9077522","01","0","","","","false"
5413,"FT_MFG_UnderIssue_OverTimeUpdateLMS_ScrapYes_OverCompl_MultipleWOs","PS9056588","01/12/2020","","9.2","FT","For  MFG WO,Perform Over issue, Enter std Time entry LMS,AddScrap,Add completion.Verify the values in P31022 Production cost inquiry.","MFG","AutHubRepo\EOne\9.2\FT","IC8871610","31A","0","PG9076925","29-6-2021","08/31/2021","false"
5417,"FT_MFG_UnderIssue_OverTimeUpdateLMS_ScrapYes_OverCompl_MultipleWOs-Maran","IC8871610","01/12/2020","","9.2","Trash","For  MFG WO,Perform Over issue, Enter std Time entry LMS,AddScrap,Add completion.Verify the values in P31022 Production cost inquiry.","MFG","AutHubRepo\EOne\9.2\Trash","IC8871610","31A","0","","","","false"
7364,"FT_SRM_VMA-F-L-INVL-ATRL01-EUR-WithTax","DL9070144","01/12/2022","2022/11/30 18:55:36","9.2","FT","Script to create purchase order, perform receipt, create VMA invoice and process it. This test case is to create a Logged voucher i.e. Single voucher per invoice line for EUR supplier 4301004 for automation rule 01","SRM","AutHubRepo\EOne\9.2\FT","DL9070144","43B","0","FQ1234567","12/07/2022","12/07/2022","false"
7363,"FT_SRM_VMA-F-L-INVL-ATRL01-EUR-NoTax","DL9070144","01/12/2022","2022/11/30 18:55:02","9.2","FT","Script to create purchase order, perform receipt, create VMA invoice and process it. This test case is to create a Logged voucher i.e. Single voucher per invoice line for EUR supplier 4301003 for automation rule 01","SRM","AutHubRepo\EOne\9.2\FT","DL9070144","43B","0","FQ1234567","12/07/2022","12/07/2022","false"
7365,"FT_SRM_VMA-F-L-INVL-ATRL04-USD-NoTax","DL9070144","01/12/2022","2022/11/30 18:56:09","9.2","FT","Script to create purchase order, perform receipt, create VMA invoice and process it. This test case is to create a Logged voucher i.e. Single voucher per invoice line for USD supplier 4304001 for automation rule 04","SRM","AutHubRepo\EOne\9.2\FT","DL9070144","43B","0","FQ1234567","12/07/2022","12/07/2022","false"
7366,"FT_SRM_VMA-F-L-INVL-ATRL04-USD-WithTax","DL9070144","01/12/2022","2022/11/30 18:56:44","9.2","FT","Script to create purchase order, perform receipt, create VMA invoice and process it. This test case is to create a Logged voucher i.e. Single voucher per invoice line for USD supplier 4304002 for automation rule 04","SRM","AutHubRepo\EOne\9.2\FT","DL9070144","43B","0","FQ1234567","12/07/2022","12/07/2022","false"
7367,"FT_SRM_VMA-F-L-INVL-ATRL04-EUR-NoTax","DL9070144","01/12/2022","2022/11/30 18:57:17","9.2","FT","Script to create purchase order, perform receipt, create VMA invoice and process it. This test case is to create a Logged voucher i.e. Single voucher per invoice line for EUR supplier 4304003 for automation rule 04","SRM","AutHubRepo\EOne\9.2\FT","DL9070144","43B","0","FQ1234567","12/07/2022","12/07/2022","false"
7368,"FT_SRM_VMA-F-L-INVL-ATRL04-EUR-WithTax","DL9070144","01/12/2022","2022/11/30 18:57:55","9.2","FT","Script to create purchase order, perform receipt, create VMA invoice and process it. This test case is to create a Logged voucher i.e. Single voucher per invoice line for EUR supplier 4304004 for automation rule 04","SRM","AutHubRepo\EOne\9.2\FT","DL9070144","43B","0","FQ1234567","12/07/2022","12/07/2022","false"
7369,"FT_SRM_VMA-F-L-INVL-ATRL05-USD-NoTax","DL9070144","01/12/2022","2022/11/30 18:58:28","9.2","FT","Script to create purchase order, perform receipt, create VMA invoice and process it. This test case is to create a Logged voucher i.e. Single voucher per invoice line for USD supplier 4305001 for automation rule 05","SRM","AutHubRepo\EOne\9.2\FT","DL9070144","43B","0","FQ1234567","12/07/2022","12/07/2022","false"
7370,"FT_SRM_VMA-F-L-INVL-ATRL05-USD-WithTax","DL9070144","01/12/2022","2022/11/30 18:59:00","9.2","FT","Script to create purchase order, perform receipt, create VMA invoice and process it. This test case is to create a Logged voucher i.e. Single voucher per invoice line for USD supplier 4305002 for automation rule 05","SRM","AutHubRepo\EOne\9.2\FT","DL9070144","43B","0","FQ1234567","12/07/2022","12/07/2022","false"
7371,"FT_SRM_VMA-F-L-INVL-ATRL05-EUR-NoTax","DL9070144","01/12/2022","2022/11/30 18:59:31","9.2","FT","Script to create purchase order, perform receipt, create VMA invoice and process it. This test case is to create a Logged voucher i.e. Single voucher per invoice line for EUR supplier 4305003 for automation rule 05","SRM","AutHubRepo\EOne\9.2\FT","DL9070144","43B","0","FQ1234567","12/07/2022","12/07/2022","false"
7362,"FT_SRM_VMA-F-L-INVL-ATRL01-USD-WithTax","DL9070144","01/12/2022","2022/11/30 18:54:22","9.2","FT","Script to create purchase order, perform receipt, create VMA invoice and process it. This test case is to create a Logged voucher i.e. Single voucher per invoice line for USD supplier 4301002 for automation rule 01","SRM","AutHubRepo\EOne\9.2\FT","DL9070144","43B","0","FQ1234567","12/07/2022","12/07/2022","false"
7361,"FT_SRM_VMA-F-L-INVL-ATRL01-USD-NoTax","DL9070144","01/12/2022","2022/11/30 18:53:43","9.2","FT","Script to create purchase order, perform receipt, create VMA invoice and process it. This test case is to create a Logged voucher i.e. Single voucher per invoice line for USD supplier 4301001 for automation rule 01","SRM","AutHubRepo\EOne\9.2\FT","DL9070144","43B","0","FQ1234567","12/07/2022","12/07/2022","false"
7372,"FT_SRM_VMA-F-L-INVL-ATRL05-EUR-WithTax","DL9070144","01/12/2022","2022/11/30 19:00:10","9.2","FT","Script to create purchase order, perform receipt, create VMA invoice and process it. This test case is to create a Logged voucher i.e. Single voucher per invoice line for EUR supplier 4305004 for automation rule 05","SRM","AutHubRepo\EOne\9.2\FT","DL9070144","43B","0","FQ1234567","12/07/2022","12/07/2022","false"
7446,"SS_02JAN_02","SS7654321","02/01/2023","2023/01/01 17:57:45","9.2","Trash","dfd","FMS","AutHubRepo\EOne\9.2\Trash","SS7654321","12","0","","","","false"
7445,"SS_02JAN_01","SS7654321","02/01/2023","2023/01/01 17:54:50","9.2","Trash","PLS","FMS","AutHubRepo\EOne\9.2\Trash","SS7654321","12","0","","","","false"
7457,"OCI Test CPT","NK9071139","02/01/2023","2023/01/02 21:59:06","9.2","Trash","","CRM","AutHubRepo\EOne\9.2\Trash","NK9071139","00","0","","","","false"
7455,"New tool trail1-Copy_Mukesh","MY9077944","02/01/2023","","9.2","Scrum","","MFG","AutHubRepo\EOne\9.2\Scrum","PS9056588","34","0","","","","false"
7450,"New tool trail1","PS9056588","02/01/2023","","9.2","Scrum","","MFG","AutHubRepo\EOne\9.2\Scrum","PS9056588","34","1","","","","false"
7452,"SS_02JAN_02-Copy","BM9077371","02/01/2023","","9.2","Trash","dfd","FMS","AutHubRepo\EOne\9.2\Trash","SS7654321","12","0","","","","false"
7451,"SS_02Jan_03","SS7654321","02/01/2023","2023/01/02 05:39:14","9.2","Trash","dsa","FMS","AutHubRepo\EOne\9.2\Trash","SS7654321","12","1","","","","false"
7449,"Trail1","PS9056588","02/01/2023","2023/01/02 04:59:58","9.2","Scrum","","MFG","AutHubRepo\EOne\9.2\Scrum","PS9056588","34","1","","","","false"
7453,"SS_02JAN_01-Copy","BM9077371","02/01/2023","","9.2","Trash","PLS","FMS","AutHubRepo\EOne\9.2\Trash","SS7654321","12","0","","","","false"
1227,"FT_SOE_SIT_PO1","SS7654321","02/02/2020","2020/02/02 20:48:54","9.2","Trash","PO","SOE","\\den01ccp.us.oracle.com\NewScriptBuilderRepo\EOne","SS7654321","01","0","","","","false"
1238,"FT_Select_DB1","SS7654321","02/02/2020","2020/02/02 21:58:00","9.2","Trash","DB1","Select","\\den01ccp.us.oracle.com\NewScriptBuilderRepo\EOne\9.2\Trash","SS7654321","01","0","","","","false"
1239,"FT_SOE_DB2","SS7654321","02/02/2020","2020/02/02 22:00:37","9.2","Trash","DB1","SOE","\\den01ccp.us.oracle.com\NewScriptBuilderRepo\EOne\9.2\Trash","SS7654321","01","0","","","","false"
1241,"FT_SOE_DB3","SS7654321","02/02/2020","2020/02/02 22:06:57","9.2","Trash","DB3","SOE","\\den01ccp.us.oracle.com\NewScriptBuilderRepo\EOne\9.2\Trash","SS7654321","01","0","","","","false"
1244,"FT_SOE_DB4","SS7654321","02/02/2020","2020/02/02 22:22:17","9.2","Trash","DB4","SOE","\\den01ccp.us.oracle.com\NewScriptBuilderRepo\EOne\9.2\Trash","SS7654321","01","0","","","","false"
1193,"FT_SOE_SIT_demo1","SS7654321","02/02/2020","2020/02/02 03:29:59","9.2","Trash","df","SOE","\\den01ccp.us.oracle.com\NewScriptBuilderRepo\EOne\Functional Test","SS7654321","01","0","","","","false"
1192,"FT_SOE_SIT_RAVI3.9","SS7654321","02/02/2020","2020/02/02 03:21:32","9.2","Trash","ravi3","SOE","\\den01ccp.us.oracle.com\NewScriptBuilderRepo\EOne\Functional Test","SS7654321","00","0","","","","false"
1190,"FT_SOE_SIT_Ravi3.4","SS7654321","02/02/2020","2020/02/02 03:02:40","9.2","Trash","fd","SOE","\\den01ccp.us.oracle.com\NewScriptBuilderRepo\EOne\Functional Test","SS7654321","00","0","","","","false"
1188,"FT_SOE_SIT_Ravi3.1","SS7654321","02/02/2020","2020/02/02 02:12:28","9.2","Trash","R3","SOE","\\den01ccp.us.oracle.com\NewScriptBuilderRepo\EOne\Functional Test","SS7654321","01","0","","","","false"
1187,"FT_SOE_SIT3_ravi3","SS7654321","02/02/2020","2020/02/02 02:09:16","9.2","Trash","dfsfd","SOE","\\den01ccp.us.oracle.com\NewScriptBuilderRepo\EOne\Functional Test","SS7654321","01","0","","","","false"
1186,"FT_SOE_SIT_Ravi2","SS7654321","02/02/2020","2020/02/02 02:01:59","9.2","Trash","sdf","SOE","\\den01ccp.us.oracle.com\NewScriptBuilderRepo\EOne\Functional Test","SS7654321","01","0","","","","false"
1185,"FT_SOE_SIT_Ravi1","SS7654321","02/02/2020","2020/02/02 01:47:10","9.2","Trash","dggfdg","SOE","\\den01ccp.us.oracle.com\NewScriptBuilderRepo\EOne\Functional Test","SS7654321","01","0","","","","false"
1184,"FT_SOE_SIT3","SS7654321","02/02/2020","2020/02/02 01:41:52","9.2","Trash","r2","SOE","\\den01ccp.us.oracle.com\NewScriptBuilderRepo\EOne\Functional Test","SS7654321","01","0","","","","false"
1180,"FT_SOE_SIT1","SS7654321","02/02/2020","2020/02/02 01:33:07","9.2","Trash","PO","SOE","\\den01ccp.us.oracle.com\NewScriptBuilderRepo\EOne\Functional Test","SS7654321","01","0","","","","false"
1182,"FT_SOE_SIT2","SS7654321","02/02/2020","2020/02/02 01:34:59","9.2","Trash","dfdfd","SOE","\\den01ccp.us.oracle.com\NewScriptBuilderRepo\EOne\Functional Test","SS7654321","01","0","","","","false"
5745,"SS_T2","SS7654321","02/02/2021","2021/02/02 06:07:59","9.2","Trash","cz","FMS","AutHubRepo\EOne\9.2\Trash","SS7654321","12","0","","","","false"
5746,"SS_T3","SS7654321","02/02/2021","2021/02/02 06:12:14","9.2","Trash","ds","FMS","AutHubRepo\EOne\9.2\Trash","SS7654321","03B","0","","","","false"
5739,"SS_01_01","SS7654321","02/02/2021","2021/02/01 20:30:27","9.2","Trash","xc","FMS","AutHubRepo\EOne\9.2\Trash","SS7654321","01","0","","","","false"
5740,"TestXpath","VK9076634","02/02/2021","2021/02/01 20:34:26","9.2","Trash","Test","SRM","AutHubRepo\EOne\9.2\Trash","VK9076634","00","0","","","","false"
5741,"SS_VA_01","SS7654321","02/02/2021","2021/02/01 22:26:53","9.2","Trash","dasdas","FMS","AutHubRepo\EOne\9.2\Trash","SS7654321","12","0","","","","false"
5742,"SS_ENCODE_01","SS7654321","02/02/2021","2021/02/01 22:57:05","9.2","Trash","dsds","FMS","AutHubRepo\EOne\9.2\Trash","SS7654321","12","0","","","","false"
5743,"Test_001","VK9076634","02/02/2021","2021/02/02 03:27:52","9.2","Trash","YTest","SRM","AutHubRepo\EOne\9.2\Trash","VK9076634","00","0","","","","false"
5744,"SS_T1","SS7654321","02/02/2021","2021/02/02 05:06:47","9.2","Trash","fdfd","FMS","AutHubRepo\EOne\9.2\Trash","SS7654321","12","0","","","","false"
8775,"FT_CRM_CAM_P13700 Resource Assignment reschedule","IC8867899","02/02/2024","2024/02/02 04:15:48","9.2","FT","CAM Resource Labor date","CRM","AutHubRepo\EOne\9.2\FT","IC8867899","13R","0","RK9078162","5-2-2024","02/06/2024","false"
8774,"FT_CRM_CAM_P90CD020 Resource Assignment reschedule","IC8867899","02/02/2024","2024/02/02 03:13:26","9.2","FT","CRM Resource WO labor ","CRM","AutHubRepo\EOne\9.2\FT","IC8867899","13R","0","IC8823870","5-2-2024","02/07/2024","false"
8773,"FT_CRM_CAM_P48201 Resource Assignment reschedule","IC8867899","02/02/2024","2024/02/02 02:41:35","9.2","FT","Resource WO Labor","CRM","AutHubRepo\EOne\9.2\FT","IC8867899","13R","0","MY9077944","5-2-2024","02/06/2024","false"
8770,"FT_CRM_CAM_P90CD020 Resource Assignment reschedule-Copy","IC8867899","02/02/2024","","9.2","FT","Reschedule of WO Labor Details","CRM","AutHubRepo\EOne\9.2\FT","IC8867899","13R","0","","","","false"
5853,"WRT_VisualAssist-Copy","MV9077101","02/03/2021","","9.2","Trash","Testing Cust Recorder. Dummy Script","Tools","AutHubRepo\EOne\9.2\Trash","SS9076765","01","0","","","","false"
5854,"Testing","MV9077101","02/03/2021","2021/03/02 02:18:39","9.2","Trash","tst","LOC","AutHubRepo\EOne\9.2\Trash","MV9077101","01","0","","","","false"
5856,"UT_DIFF","SD9077442","02/03/2021","2021/03/02 04:03:28","9.2","Trash","","FMS","AutHubRepo\EOne\9.2\Trash","SD9077442","00","0","","","","false"
5857,"Test4.0","MV9077101","02/03/2021","2021/03/02 06:57:36","9.2","Trash","a","OFP","AutHubRepo\EOne\9.2\Trash","MV9077101","01","0","","","","false"
7627,"FT_HCM_BUG_34829233_TIME_ENTRY_TEST_CASE_2","BV9077354","02/03/2023","2023/03/02 22:24:30","9.2","FT","","HCM","AutHubRepo\EOne\9.2\FT","BV9077354","05T","0","IC8823870","29-3-2023","04/25/2023","false"
7628,"FT_HCM_BUG_34372866_DEP_UNENR_TC1","IC8999058","02/03/2023","2023/03/02 23:22:42","9.2","Trash","Unenrolling Dependent Using P08334","HCM","AutHubRepo\EOne\9.2\Trash","IC8999058","08B","0","","","","false"
7623,"TestDemo","RK9078162","02/03/2023","2023/03/02 02:52:08","9.2","Trash","first testing","FMS","AutHubRepo\EOne\9.2\Trash","RK9078162","01","1","","","","false"
1829,"FT_SOE_SS_B15","SS7654321","02/04/2020","2020/04/02 02:13:49","9.2","Trash","dfd","SOE","\\den01ccp.us.oracle.com\NewScriptBuilderRepo\EOne\9.2\Trash","SS7654321","00","0","","","","false"
1828,"FT_SOE_SS_B13","SS7654321","02/04/2020","2020/04/02 02:08:04","9.2","Trash","fddf","SOE","\\den01ccp.us.oracle.com\NewScriptBuilderRepo\EOne\9.2\Trash","SS7654321","00","0","","","","false"
1831,"FT_SOE_SS_B21","SS7654321","02/04/2020","2020/04/02 03:13:21","9.2","Trash","sd","SOE","\\den01ccp.us.oracle.com\NewScriptBuilderRepo\EOne\9.2\Trash","SS7654321","00","0","","","","false"
1832,"FT_SOE_SS_B22","SS7654321","02/04/2020","2020/04/02 04:22:32","9.2","Trash","sdds","SOE","\\den01ccp.us.oracle.com\NewScriptBuilderRepo\EOne\9.2\Trash","SS7654321","00","0","","","","false"
1833,"FT_SOE_SS_B23","SS7654321","02/04/2020","2020/04/02 04:34:32","9.2","Trash","fdf","SOE","\\den01ccp.us.oracle.com\NewScriptBuilderRepo\EOne\9.2\Trash","SS7654321","00","0","","","","false"
1843,"FT_SOE_SS_C1","SS7654321","02/04/2020","2020/04/02 21:05:27","9.2","Trash","jkh","SOE","\\den01ccp.us.oracle.com\NewScriptBuilderRepo\EOne\9.2\Trash","SS7654321","00","0","","","","false"
1845,"FT_SOE_SS_C3_17marside","SS7654321","02/04/2020","2020/04/02 21:54:46","9.2","Trash","dfd","SOE","\\den01ccp.us.oracle.com\NewScriptBuilderRepo\EOne\9.2\Trash","SS7654321","00","0","","","","false"
1844,"FT_SOE_SS_C2","SS7654321","02/04/2020","2020/04/02 21:40:23","9.2","Trash","sds","SOE","\\den01ccp.us.oracle.com\NewScriptBuilderRepo\EOne\9.2\Trash","SS7654321","00","0","","","","false"
1846,"FT_SOE_SS_C4_Assertcancelside","SS7654321","02/04/2020","2020/04/02 21:56:30","9.2","Trash","sdf","SOE","\\den01ccp.us.oracle.com\NewScriptBuilderRepo\EOne\9.2\Trash","SS7654321","00","0","","","","false"
1847,"FT_SOE_SS_C4_BranchTest","SS7654321","02/04/2020","2020/04/02 21:58:47","9.2","Trash","ssf","SOE","\\den01ccp.us.oracle.com\NewScriptBuilderRepo\EOne\9.2\Trash","SS7654321","00","0","","","","false"
1848,"FT_SOE_SS_C5_AssertCancel1","SS7654321","02/04/2020","2020/04/02 22:02:21","9.2","Trash","fdfd","SOE","\\den01ccp.us.oracle.com\NewScriptBuilderRepo\EOne\9.2\Trash","SS7654321","01","0","","","","false"
1849,"FT_SOE_SS_C6_branchTest1","SS7654321","02/04/2020","2020/04/02 22:05:00","9.2","Trash","fddf","SOE","\\den01ccp.us.oracle.com\NewScriptBuilderRepo\EOne\9.2\Trash","SS7654321","00","0","","","","false"
1852,"FT_SOE_SS_C21_AssertCancel","SS7654321","02/04/2020","2020/04/02 23:20:24","9.2","Trash","sds","SOE","\\den01ccp.us.oracle.com\NewScriptBuilderRepo\EOne\9.2\Trash","SS7654321","00","0","","","","false"
1853,"FT_SOE_SS_C23_AssertCancel","SS7654321","02/04/2020","2020/04/02 23:23:12","9.2","Trash","sds","SOE","\\den01ccp.us.oracle.com\NewScriptBuilderRepo\EOne\9.2\Trash","SS7654321","00","0","","","","false"
1822,"FT_SOE_SS_A17","SS7654321","02/04/2020","2020/04/02 00:11:17","9.2","Trash","jhj","SOE","\\den01ccp.us.oracle.com\NewScriptBuilderRepo\EOne\9.2\Trash","SS7654321","00","0","","","","false"
1830,"FT_SOE_SS_B17","SS7654321","02/04/2020","2020/04/02 02:23:44","9.2","Trash","jhfgf","SOE","\\den01ccp.us.oracle.com\NewScriptBuilderRepo\EOne\9.2\Trash","SS7654321","00","0","","","","false"
1826,"FT_SOE_SS_B11","SS7654321","02/04/2020","2020/04/02 01:55:17","9.2","Trash","dfd","SOE","\\den01ccp.us.oracle.com\NewScriptBuilderRepo\EOne\9.2\Trash","SS7654321","00","0","","","","false"
1827,"FT_SOE_SS_B12","SS7654321","02/04/2020","2020/04/02 02:00:21","9.2","Trash","fdfd","SOE","\\den01ccp.us.oracle.com\NewScriptBuilderRepo\EOne\9.2\Trash","SS7654321","00","0","","","","false"
8825,"FT_MFG_ZEROEURQTY_FT2","PS9056588","02/04/2024","2024/04/01 22:04:15","9.2","FT","","MFG","AutHubRepo\EOne\9.2\FT","PS9056588","31B","0","SR9078040","10-5-2024","","false"
2660,"FT_SOE_SS_02M_01","SS7654321","02/05/2020","2020/05/01 19:56:06","9.2","Trash","sds","SOE","AutHubRepo\EOne\9.2\Trash","SS7654321","00","0","","","","false"
2662,"FT_SOE_SS_0808","SS7654321","02/05/2020","2020/05/01 21:08:22","9.2","Trash","dsds","SOE","AutHubRepo\EOne\9.2\Trash","SS7654321","00","0","","","","false"
2661,"FT_SOE_SS_02M_Log","SS7654321","02/05/2020","2020/05/01 20:00:11","9.2","Trash","sds","SOE","AutHubRepo\EOne\9.2\Trash","SS7654321","00","0","","","","false"
7891,"FT_FMS_NONCUR_P0413M Add a manual payment_post","IC8735933","02/05/2023","2023/05/01 20:43:30","9.2","FT","Please note, this script is to test payment functionality when currency is set to OFF.<br>Login to Constant scenario : PY920NC<br>Role : FMS1<br><br>P0413M | QAZJDE0001<br>Add 2 line voucher and manual payment and match two pay items. post the payment<br><br>Persistent Data:<br>Co 80003<br>BU 800031<br>Supplier: 800033<br>","FMS","AutHubRepo\EOne\9.2\FT","IC8735933","04","0","MY9077944","28-7-2023","","false"
7894,"FT_FMS_NONCUR_Add a one line voucher_Manual payment_Post","IC8735933","02/05/2023","","9.2","FT","Please note, this script is to test payment functionality when currency is set to OFF.<br>Login to Constant scenario : PY920NC<br>Role : FMS1<br><br>P0413M | QAZJDE0001<br>Add a voucher and manual payment and match two pay items. post the payment<br><br>Persistent Data:<br>Co 80003<br>BU 800031<br>Supplier: 800033<br>","FMS","AutHubRepo\EOne\9.2\FT","IC8735933","04","0","MY9077944","28-7-2023","","false"
7895,"UDO_Grouping_check","SR9078040","02/05/2023","2023/05/02 21:29:44","9.2","Trash","","FMS","AutHubRepo\EOne\9.2\Trash","SR9078040","01","0","","","","false"
3147,"SS_KIASVA_01","SS7654321","02/06/2020","2020/06/01 21:43:17","9.2","Trash","xcxcxcxc","SOE","AutHubRepo\EOne\9.2\Trash","SS7654321","01","0","","","","false"
3162,"SS_GRIDRECORDTEST_01","SS7654321","02/06/2020","2020/06/02 07:14:13","9.2","Trash","dsds","SOE","AutHubRepo\EOne\9.2\Trash","SS7654321","01","0","","","","false"
3148,"SS_KIASVA_02","SS7654321","02/06/2020","2020/06/01 21:46:00","9.2","Trash","fdfd","SOE","AutHubRepo\EOne\9.2\Trash","SS7654321","00","0","","","","false"
3149,"SS_KIASVA_04","SS7654321","02/06/2020","2020/06/02 00:14:29","9.2","Trash","dsds","SOE","AutHubRepo\EOne\9.2\Trash","SS7654321","00","0","","","","false"
3150,"SS_KIASVA_05","SS7654321","02/06/2020","2020/06/02 00:24:58","9.2","Trash","dsd","SOE","AutHubRepo\EOne\9.2\Trash","SS7654321","00","0","","","","false"
3151,"SS_KIASFULLFLOW_01","SS7654321","02/06/2020","2020/06/02 00:35:23","9.2","Trash","sds","SOE","AutHubRepo\EOne\9.2\Trash","SS7654321","03B","0","","","","false"
3157,"FT_CRM_SiteIntegrity","RJ9076378","02/06/2020","2020/06/02 04:04:17","9.2","Trash","test","CRM","AutHubRepo\EOne\9.2\Trash","RJ9076378","03B","0","","","","false"
3163,"SS_GRIDRECORD_03","SS7654321","02/06/2020","2020/06/02 07:50:19","9.2","Trash","dsd","SOE","AutHubRepo\EOne\9.2\Trash","SS7654321","01","0","","","","false"
3159,"SS_KIASFULLFLOW_02","SS7654321","02/06/2020","2020/06/02 05:49:04","9.2","Trash","sds","SOE","AutHubRepo\EOne\9.2\Trash","SS7654321","00","0","","","","false"
3158,"FT_MFG_Check for Conflicts Fixed  tasks Forward schedule","RD9076642","02/06/2020","2020/06/02 04:23:04","9.2","FT","","MFG","AutHubRepo\EOne\9.2\FT","RD9076642","01","0","","","","false"
6958,"Test0206","SP9077688","02/06/2022","2022/06/02 04:50:08","9.2","Trash","","FMS","AutHubRepo\EOne\9.2\Trash","SP9077688","01","0","","","","false"
7982,"FT_HCM_Bug_31885165_TestCase_4","BV9077354","02/06/2023","2023/06/02 03:54:27","9.2","FT","","HCM","AutHubRepo\EOne\9.2\FT","BV9077354","07","0","NK9071139","21-6-2023","06/27/2023","false"
7977,"FT_HCM_BUG 34077246_TEST2","IG9077696","02/06/2023","2023/06/02 01:57:45","9.2","FT","Test Case 2 of the bug 34077246","HCM","AutHubRepo\EOne\9.2\FT","IG9077696","07","0","BM9077371","21-6-2023","06/27/2023","false"
7978,"FT_HCM_BUG 31485364_TEST2","IG9077696","02/06/2023","2023/06/02 01:59:16","9.2","FT","Test Case 2 of the bug 31485364","HCM","AutHubRepo\EOne\9.2\FT","IG9077696","07","0","NK9071139","21-6-2023","06/27/2023","false"
7980,"FT_HCM_Bug_31885165_TestCase_1","BV9077354","02/06/2023","2023/06/02 03:13:33","9.2","FT","","HCM","AutHubRepo\EOne\9.2\FT","BV9077354","07","0","NK9071139","21-6-2023","06/27/2023","false"
7981,"FT_HCM_SAMPLE DATA","BV9077354","02/06/2023","2023/06/02 03:42:04","9.2","Trash","","HCM","AutHubRepo\EOne\9.2\Trash","BV9077354","07","0","","","","false"
3741,"RPT-Copy","PS9074823","02/07/2020","","9.2","Trash","","SRM","AutHubRepo\EOne\9.2\Trash","PS9074823","43","0","","","","false"
3740,"MKR","PS9074823","02/07/2020","2020/07/02 03:18:02","9.2","Trash","","SRM","AutHubRepo\EOne\9.2\Trash","PS9074823","43","0","","","","false"
3738,"WRT_example2","BP9077063","02/07/2020","2020/07/02 02:21:33","9.2","Trash","","Tools","AutHubRepo\EOne\9.2\Trash","BP9077063","00","0","","","","false"
3739,"WRT_use_submit","BP9077063","02/07/2020","2020/07/02 02:39:38","9.2","Trash","","Tools","AutHubRepo\EOne\9.2\Trash","BP9077063","00","0","","","","false"
3737,"FT_SOE_SO_Creation","SS7654321","02/07/2020","2020/07/02 00:39:51","9.2","Trash","CreateSO","SOE","AutHubRepo\EOne\9.2\Trash","SS7654321","42","0","","","","false"
3735,"SS_TESTVM_01","SS7654321","02/07/2020","2020/07/01 21:27:12","9.2","Trash","sds","SOE","AutHubRepo\EOne\9.2\Trash","SS7654321","12","0","","","","false"
9010,"FT_SOE_QA_36637829_OutboundFutureCommit","SS9070540","02/07/2024","2024/07/02 03:11:11","9.2","FT","","SOE","AutHubRepo\EOne\9.2\FT","SS9070540","42","0","MY9077944","8-7-2024","07/09/2024","false"
3987,"FT_MFG_OverIssue_StdTimeUpdateforB2only_NoScrap_NoCompl_MultipleWOs","PS9056588","02/08/2020","","9.2","Trash","For  MFG WO,Perform Under issue, Enter std Time entry for labour,machine and setup,No Scrap,No completion.Verify the values in P31022 Production cost inquiry.","MFG","AutHubRepo\EOne\9.2\Trash","IC8871610","31A","0","","","","false"
3986,"FT_MFG_OverIssue_UnderTimeUpdateforB1only_NoScrap_NoCompl_MultipleWOs","PS9056588","02/08/2020","","9.2","Trash","For  MFG WO,Perform Under issue, Enter std Time entry for labour,machine and setup,No Scrap,No completion.Verify the values in P31022 Production cost inquiry.","MFG","AutHubRepo\EOne\9.2\Trash","IC8871610","31A","0","","","","false"
3988,"FT_MFG_OverIssue_OverTimeUpdateforB2only_NoScrap_NoCompl_MultipleWOs","PS9056588","02/08/2020","","9.2","Trash","For  MFG WO,Perform Under issue, Enter std Time entry for labour,machine and setup,No Scrap,No completion.Verify the values in P31022 Production cost inquiry.","MFG","AutHubRepo\EOne\9.2\Trash","IC8871610","31A","0","","","","false"
8328,"MFG_TRANSPORTATION_LOCHOLD_INBOUNDC4","HS9075527","02/08/2023","2023/08/02 03:22:48","9.2","BPF","","MFG","AutHubRepo\EOne\9.2\BPF","HS9075527","41","0","NK9071139","8-11-2023","11/15/2023","false"
8327,"OrcTest_Aug2nd","SR9078040","02/08/2023","2023/08/02 02:12:05","9.2","Trash","","MFG","AutHubRepo\EOne\9.2\Trash","SR9078040","10","0","","","","false"
8306,"SS_ORC_02AUG_01","SS7654321","02/08/2023","2023/08/01 21:25:48","9.2","Trash","Orc Test","FMS","AutHubRepo\EOne\9.2\Trash","SS7654321","01","0","","","","false"
8307,"FT_FMS_AP Method End to end Process for DIV","IC9031954","02/08/2023","2023/08/01 21:53:42","9.2","FT","","FMS","AutHubRepo\EOne\9.2\FT","IC9031954","04","1","NK9071139","8-11-2023","","false"
8303,"SS_02AUG_01","SS7654321","02/08/2023","2023/08/01 20:45:52","9.2","Trash","Test","FMS","AutHubRepo\EOne\9.2\Trash","SS7654321","01","0","","","","false"
4753,"FT_FMS_FA_ProcessingOptions_R12855","AP9076327","02/09/2020","","9.2","FT","Script to set up processing options for P1204","FMS","AutHubRepo\EOne\9.2\FT","AP9076327","12","0","","","","false"
4765,"FT_HCM_Test Tax Levy","PY9072027","02/09/2020","2020/09/02 05:35:53","9.2","Trash","Tax Levy Wage Attachment.","HCM","AutHubRepo\EOne\9.2\Trash","PY9072027","07","0","","","","false"
4758,"FT_HCM_Election of Plan Option_Enrollment Override","BV9077354","02/09/2020","2020/09/02 03:13:45","9.2","FT","Election of Plan Option_Enrollment Override","HCM","AutHubRepo\EOne\9.2\FT","BV9077354","08B","0","FQ1234567","10/22/2022","10/22/2022","false"
4759,"FT_SRM_Amt.Level adjustment with blank reprice group, Negative Qty, Auto reprice ON","PS9074823","02/09/2020","","9.2","Trash","","SRM","AutHubRepo\EOne\9.2\Trash","PS9074823","43","0","","","","false"
4755,"FT_HCM_Personal Employee Information Workfile Build R054101","BV9077354","02/09/2020","2020/09/02 02:38:27","9.2","FT","","HCM","AutHubRepo\EOne\9.2\FT","BV9077354","08","0","BM9077371","18-6-2021","08/31/2021","false"
4761,"FT_FMS_FA_ProcessingOptions_R12845","AP9076327","02/09/2020","","9.2","FT","Script to set up processing options for P1204","FMS","AutHubRepo\EOne\9.2\FT","AP9076327","12","0","","","","false"
4756,"FT_HCM_Retest eligibility(plan elections_enroll with elig)","BV9077354","02/09/2020","2020/09/02 02:50:07","9.2","FT","RETEST ELIGIBILITY","HCM","AutHubRepo\EOne\9.2\FT","BV9077354","08B","0","IC8823870","18-5-2021","08/31/2021","false"
4760,"FT_SOE_gross Profit Margin Advance Preference P42101","SP9073695","02/09/2020","","9.2","FT","Verify the Gross profit margin Advance preference in P4210 in Add update and copy mode
item QA600, customer 9669, QAPROFIT  is the preference schedule and Gprofit is the Adjustment Schedule  ","SOE","AutHubRepo\EOne\9.2\FT","SP9073695","45","0","BM9077371","18-6-2021","08/31/2021","false"
4764,"FT_HCM_Change Amount or Rate_Enrollment Overrides","BR9077291","02/09/2020","2020/09/02 05:31:13","9.2","FT","","HCM","AutHubRepo\EOne\9.2\FT","BR9077291","08B","0","SS9076765","29-6-2021","08/31/2021","false"
6587,"FT_SRM_DeleteLoggedVoucher Ready to Match PT2 PO is Blank","IC9016551","02/09/2021","2021/09/02 02:15:49","9.2","FT","","SRM","AutHubRepo\EOne\9.2\FT","IC9016551","43B","0","","","","false"
6589,"KIas issue","SS7654321","02/09/2021","","9.2","FT","","SRM","AutHubRepo\EOne\9.2\FT","IC9016551","43B","0","","","","false"
6590,"Grouping issue - FT SRM by Khias","BM9077371","02/09/2021","","9.2","FT","","SRM","AutHubRepo\EOne\9.2\FT","IC9016551","43B","0","","","","false"
6588,"FT_SRM_DeleteLoggedVoucher Ready to Match PT2 POBlnk-YB","BY9073409","02/09/2021","","9.2","FT","","SRM","AutHubRepo\EOne\9.2\FT","IC9016551","43B","0","","","","false"
7182,"FT_SRM_P4314WB ATRL06 SVPIL FEE INSERT F4311","IC8823790","02/09/2022","2022/09/02 00:57:56","9.2","FT","Invoice fee match for rule 6 using P4314WB with SVPIL. Fee line is set to insert into F4311","SRM","AutHubRepo\EOne\9.2\FT","IC8823790","43B","0","IC8823870","16-11-2022","11/23/2022","false"
7229,"FT_SRM_P4314WB SVPI fee line insert in F4311-csao","CS9076571","02/10/2022","","9.2","FT","With Single voucher per invoice turned ON and P0411z1 batch has invoice and fee lines verify that a single PV document is created and fee line is inserted into the matched purchase order.","SRM","AutHubRepo\EOne\9.2\FT","IC8823790","43B","0","","","","false"
8597,"FT_SRM_P4074 Pur Uom change and grid refresh","IC8823790","02/10/2023","2023/10/02 04:00:25","9.2","FT","Verify price is updated in the grid when Purchasing UOM is changed in the header of P4074. also verify the grid is refreshed when qty is blanked out in the header.<br>UOM conversion  1CA=12EA","SRM","AutHubRepo\EOne\9.2\FT","IC8823790","43","0","NK9071139","8-11-2023","11/16/2023","false"
8598,"FT_SOE_Bug35195983_SDODCancel","KS9078066","02/10/2023","2023/10/02 12:04:14","9.2","FT","To verify the Open order amt when we we cancel the OD order and the corresponding SD order gets cancelled.","SOE","AutHubRepo\EOne\9.2\FT","KS9078066","42","0","NK9071139","8-11-2023","11/24/2023","false"
5128,"FT_MFG_Update_Multiple Work Orders_ Status Thru P31225","IC8871610","02/11/2020","","9.2","FT","","MFG","AutHubRepo\EOne\9.2\FT","IC8871610","48","0","","","","false"
5126,"FT_MFG_Update a Work Order Status Thru P31225","IC8871610","02/11/2020","2020/11/01 23:46:42","9.2","FT","","MFG","AutHubRepo\EOne\9.2\FT","IC8871610","48","0","IC8823870","21-6-2021","08/31/2021","false"
6697,"New2-Copy-Copy","MO9077792","02/11/2021","","9.2","Trash","","FMS","AutHubRepo\EOne\9.2\Trash","MO9077792","01","0","","","","false"
7273,"FT_HCM_Bug_34238887_testing","AS9077848","02/11/2022","2022/11/02 01:58:30","9.2","FT","A section of bug","HCM","AutHubRepo\EOne\9.2\FT","AS9077848","07","1","","","","false"
7276,"FT_HCM_Bug_34238887_Payroll","AS9077848","02/11/2022","2022/11/02 02:52:52","9.2","FT","","HCM","AutHubRepo\EOne\9.2\FT","AS9077848","07","1","","","","false"
5420,"FT_MFG_NoIssue_StdForL,M,STime_NoScrap_NoCompletion_MultipleWO-Copy","RR9076538","02/12/2020","","9.2","Trash","","MFG","AutHubRepo\EOne\9.2\Trash","IC8871610","31A","0","","","","false"
5421,"FT_MFG_R31804_STDIssue_STDUpdateforL,M,S_ScrapNo_OverCompletion_MultipleWO","SL9077266","02/12/2020","","9.2","FT","Validate R31804 for standard Issue, Standard Time Update for labor, Machine and Setup, without Scrap and Over completions","MFG","AutHubRepo\EOne\9.2\FT","SL9077266","31A","0","PG9076925","5-7-2021","08/31/2021","false"
5422,"FT_MFG_UnderIssue_UnderTimeUpdateLMS_ScrapYes_StdCompl_MultipleWOs","PS9056588","02/12/2020","","9.2","FT","For  MFG WO,Perform Over issue, Enter std Time entry LMS,AddScrap,Add completion.Verify the values in P31022 Production cost inquiry.","MFG","AutHubRepo\EOne\9.2\FT","IC8871610","31A","0","VK9076634","29-6-2021","08/31/2021","false"
6724,"WRT_Check JAS Login","TH9077741","02/12/2021","2021/12/02 22:54:40","9.2","FT","","Tools","AutHubRepo\EOne\9.2\FT","TH9077741","01","0","","","","false"
6723,"Test03122021","SP9077688","02/12/2021","2021/12/02 23:07:13","9.2","Trash","","CRM","AutHubRepo\EOne\9.2\Trash","SP9077688","00","0","","","","false"
6722,"Test0312","SP9077688","02/12/2021","2021/12/02 22:42:05","9.2","Trash","","CRM","AutHubRepo\EOne\9.2\Trash","SP9077688","00","0","","","","false"
6741,"WRT_Bar_Code validation","BM9077371","03/01/2022","2022/01/03 21:34:39","9.2","Trash","test","Tools","AutHubRepo\EOne\9.2\Trash","BM9077371","00","0","","","","false"
7458,"Trail1_SKD","SD9077442","03/01/2023","","9.2","Scrum","","MFG","AutHubRepo\EOne\9.2\Scrum","PS9056588","34","0","","","","false"
7459,"WRT_Test_0301","SP9077688","03/01/2023","2023/01/03 04:51:42","9.2","Trash","","Tools","AutHubRepo\EOne\9.2\Trash","SP9077688","01","0","","","","false"
7461,"Check_001","PG9076925","03/01/2023","2023/01/03 21:53:08","9.2","Trash","","CRM","AutHubRepo\EOne\9.2\Trash","PG9076925","00","0","","","","false"
7462,"check_002","PG9076925","03/01/2023","2023/01/03 21:59:42","9.2","Trash","","CRM","AutHubRepo\EOne\9.2\Trash","PG9076925","00","0","","","","false"
8741,"Demo_jan3","PG9076925","03/01/2024","2024/01/03 02:23:32","9.2","Trash","","FMS","AutHubRepo\EOne\9.2\Trash","PG9076925","00","0","","","","false"
1304,"FT_SOE_CreateSO","SS7654321","03/02/2020","2020/02/03 08:49:56","9.2","Trash","CreateSO","Select","\\den01ccp.us.oracle.com\NewScriptBuilderRepo\EOne\9.2\Trash","SS7654321","42","0","","","","false"
1305,"FT_SOE_SOEntry","SS7654321","03/02/2020","2020/02/03 09:37:19","9.2","Trash","SOEntry","SOE","\\den01ccp.us.oracle.com\NewScriptBuilderRepo\EOne\9.2\Trash","SS7654321","42","0","","","","false"
1299,"SRM_LOGINTEST","SS7654321","03/02/2020","2020/02/03 06:58:00","9.2","Trash","http://denac143.us.oracle.com:2022/jde/E1Menu.maf","SRM","\\den01ccp.us.oracle.com\NewScriptBuilderRepo\EOne\9.2\Trash","SS7654321","01","0","","","","false"
1296,"FT_SOE_SampleLogin","SS7654321","03/02/2020","2020/02/03 06:33:36","9.2","Trash","uttyu","SOE","\\den01ccp.us.oracle.com\NewScriptBuilderRepo\EOne\9.2\Trash","SS7654321","42","0","","","","false"
1294,"FT_SOE_Login_ravi","SS7654321","03/02/2020","2020/02/03 06:09:22","9.2","Trash","dfd","SOE","\\den01ccp.us.oracle.com\NewScriptBuilderRepo\EOne\9.2\Trash","SS7654321","42","0","","","","false"
1287,"FT_SOE_Login3","SS7654321","03/02/2020","2020/02/03 05:04:21","9.2","Trash","uut","SOE","\\den01ccp.us.oracle.com\NewScriptBuilderRepo\EOne\9.2\Trash","SS7654321","01","0","","","","false"
1306,"TestFms","VK9070582","03/02/2020","2020/02/03 20:14:31","9.2","Trash","","FMS","\\den01ccp.us.oracle.com\NewScriptBuilderRepo\EOne\9.2\Trash","VK9070582","03B","0","","","","false"
1307,"FT_SOE_SOE","SS7654321","03/02/2020","2020/02/03 21:26:14","9.2","Trash","SOE","SOE","\\den01ccp.us.oracle.com\NewScriptBuilderRepo\EOne\9.2\Trash","SS7654321","01","0","","","","false"
1311,"FT_Select_BR1","SS7654321","03/02/2020","2020/02/03 22:19:56","9.2","Trash","SOB","Select","\\den01ccp.us.oracle.com\NewScriptBuilderRepo\EOne\9.2\Trash","SS7654321","42","0","","","","false"
1313,"FT_SOE_BR2","SS7654321","03/02/2020","2020/02/03 22:28:41","9.2","Trash","SOB","SOE","\\den01ccp.us.oracle.com\NewScriptBuilderRepo\EOne\9.2\Trash","SS7654321","01","0","","","","false"
1314,"FT_SOE_SOCreatioTG1","SS7654321","03/02/2020","2020/02/03 22:56:25","9.2","Trash","SOCreationTG1","SOE","\\den01ccp.us.oracle.com\NewScriptBuilderRepo\EOne\9.2\Trash","SS7654321","42","0","","","","false"
1321,"FT_SOE_FindTest","SS7654321","03/02/2020","2020/02/03 23:48:04","9.2","Trash","SideTest","SOE","\\den01ccp.us.oracle.com\NewScriptBuilderRepo\EOne\9.2\Trash","SS7654321","00","0","","","","false"
1266,"FT_SOE_SalesOrderCreation","SS7654321","03/02/2020","2020/02/03 00:33:01","9.2","Trash","Sales Order Creation","SOE","\\den01ccp.us.oracle.com\NewScriptBuilderRepo\EOne\9.2\Trash","SS7654321","42","0","","","","false"
1270,"FT_SOE_Feb3.1","SS7654321","03/02/2020","2020/02/03 02:17:00","9.2","Trash","sd","SOE","\\den01ccp.us.oracle.com\NewScriptBuilderRepo\EOne\9.2\Trash","SS7654321","01","0","","","","false"
1276,"FT_SOE_Feb3.2","SS7654321","03/02/2020","2020/02/03 03:42:18","9.2","Trash","sds","SOE","\\den01ccp.us.oracle.com\NewScriptBuilderRepo\EOne\9.2\Trash","SS7654321","03B","0","","","","false"
1278,"FT_SOE_Login","SS7654321","03/02/2020","2020/02/03 04:04:01","9.2","Trash","nkn","SOE","\\den01ccp.us.oracle.com\NewScriptBuilderRepo\EOne\9.2\Trash","SS7654321","00","0","","","","false"
1282,"FT_SOE_Login1","SS7654321","03/02/2020","2020/02/03 04:31:40","9.2","Trash","sds","SOE","\\den01ccp.us.oracle.com\NewScriptBuilderRepo\EOne\9.2\Trash","SS7654321","01","0","","","","false"
1284,"FT_SOE_Login 2","SS7654321","03/02/2020","2020/02/03 04:39:39","9.2","Trash","ds","SOE","\\den01ccp.us.oracle.com\NewScriptBuilderRepo\EOne\9.2\Trash","SS7654321","42","0","","","","false"
5749,"eee","SS7654321","03/02/2021","2021/02/02 22:06:23","9.2","Trash","cz","FMS","AutHubRepo\EOne\9.2\Trash","SS7654321","01","0","","","","false"
5750,"DEMO_01","SS7654321","03/02/2021","2021/02/02 22:59:21","9.2","Trash","fgfgdf","FMS","AutHubRepo\EOne\9.2\Trash","SS7654321","03B","0","","","","false"
5762,"TestPLS","IC8838633","03/02/2021","","9.2","Trash","","SOE","AutHubRepo\EOne\9.2\Trash","IC8838633","45","0","","","","false"
5751,"CR_1","MV9077101","03/02/2021","2021/02/03 00:38:56","9.2","Trash","tst","FMS","AutHubRepo\EOne\9.2\Trash","MV9077101","01","0","","","","false"
7564,"FT_SOE_Pricehistoryp42101-Copy","null","03/02/2023","","9.2","FT","","SOE","AutHubRepo\EOne\9.2\FT","SP9073695","45","0","","","","false"
1560,"FT_FMS_Overhead","RA9053539","03/03/2020","2020/03/03 23:22:20","9.2","Trash","P09J50 Test","FMS","\\den01ccp.us.oracle.com\NewScriptBuilderRepo\EOne\9.2\Trash","RA9053539","09J","0","","","","false"
1561,"Powerform","RA9053539","03/03/2020","2020/03/03 23:43:35","9.2","Trash","","FMS","\\den01ccp.us.oracle.com\NewScriptBuilderRepo\EOne\9.2\Trash","RA9053539","09J","0","","","","false"
5864,"CRM_FT_CRM_P12011 Display","RR9076538","03/03/2021","2021/03/03 07:05:31","9.2","BPF","","CRM","AutHubRepo\EOne\9.2\BPF","RR9076538","01","0","","","","false"
5868,"CRM_SWM_03","RR9076538","03/03/2021","2021/03/03 08:03:56","9.2","BPF","","CRM","AutHubRepo\EOne\9.2\BPF","RR9076538","03B","0","","","","false"
5863,"NATEST3","VK9076634","03/03/2021","2021/03/03 00:19:29","9.2","Trash","TESTNA3","SRM","AutHubRepo\EOne\9.2\Trash","VK9076634","00","0","","","","false"
5862,"TESTNA2","VK9076634","03/03/2021","2021/03/03 00:17:44","9.2","Trash","Test NA2","SRM","AutHubRepo\EOne\9.2\Trash","VK9076634","00","0","","","","false"
5861,"NATEST1","VK9076634","03/03/2021","2021/03/03 00:15:52","9.2","Trash","Test NA2","SRM","AutHubRepo\EOne\9.2\Trash","VK9076634","00","0","","","","false"
5860,"NATEST","VK9076634","03/03/2021","2021/03/03 00:07:26","9.2","Trash","TEST NA","SRM","AutHubRepo\EOne\9.2\Trash","VK9076634","00","0","","","","false"
5859,"FT_SRM_CreateSO_Demo","SS7654321","03/03/2021","2021/03/02 21:22:56","9.2","FT","CreateSO","SRM","AutHubRepo\EOne\9.2\FT","SS7654321","42","0","","","","false"
5858,"FT_SRM_CreatePO_Demo","SS7654321","03/03/2021","2021/03/02 21:03:59","9.2","FT","Create PO","SRM","AutHubRepo\EOne\9.2\FT","SS7654321","42","0","","","","false"
7644,"FT_HCM_Bug_34387829_AsectionoftheBug","AS9077848","03/03/2023","2023/03/03 05:01:55","9.2","FT","A section","HCM","AutHubRepo\EOne\9.2\FT","AS9077848","77","0","NK9071139","8-11-2023","11/17/2023","false"
7642,"FT_HCM_BUG_34372866_BATCH_DEPUNRL","IC8999058","03/03/2023","2023/03/03 04:19:30","9.2","Trash","Unenrolling Dependent Using Batch Enrollment","HCM","AutHubRepo\EOne\9.2\Trash","IC8999058","08B","0","","","","false"
7641,"FT_HCM_Bug_34387829_Asection-Copy","AS9077848","03/03/2023","","9.2","FT","A section","HCM","AutHubRepo\EOne\9.2\FT","AS9077848","77","1","","","","false"
7640,"FT_HCM_BUG_35000807_CA_INTERIM_PRINTALL-Copy","BV9077354","03/03/2023","","9.2","FT","Persistent data<br>1. Created 3 CA EEs 9737201 to 9737203 with auto deposit instruction.<br>2. Created an Interim ID B35000807 and added interim for all three employees.<br>3. Selected the EE 9737202 and done the Print Payment.<<br>Script:<br>1. FP to P07210I and filter for B35000807.<br>2. Select the interim ID and Row exit Print payment.<br>3. Validate all the check boxed are enabled.<br>4. Check the check boxes and submitted.","HCM","AutHubRepo\EOne\9.2\FT","BV9077354","77","0","","","","false"
7639,"FT_HCM_BUG_34372866_Override_TC1","IC8999058","03/03/2023","2023/03/03 03:40:38","9.2","Trash","Unenrolling Dependent Using Enrollment Override","HCM","AutHubRepo\EOne\9.2\Trash","IC8999058","08B","0","","","","false"
7637,"FT_HCM_Bug_34387829_Asection","AS9077848","03/03/2023","2023/03/03 03:12:16","9.2","FT","A section","HCM","AutHubRepo\EOne\9.2\FT","AS9077848","77","1","","","","false"
7631,"FT_HCM_BUG_33065440_TEST2","IG9077696","03/03/2023","2023/03/03 01:36:26","9.2","FT","BUG 33065440 - NO PROVINCIAL INCOME TAX DEDUCTED WHEN BONUS PAYMENT NETS TO ZERO","HCM","AutHubRepo\EOne\9.2\FT","IG9077696","77","0","IC8823870","29-3-2023","04/02/2023","false"
7630,"FT_HCM_BUG_33065440_A_SECTION","IG9077696","03/03/2023","2023/03/03 01:33:39","9.2","FT","BUG 33065440 - NO PROVINCIAL INCOME TAX DEDUCTED WHEN BONUS PAYMENT NETS TO ZERO","HCM","AutHubRepo\EOne\9.2\FT","IG9077696","77","0","SR9078040","29-3-2023","07/19/2023","false"
7634,"FT_HCM_USEECRT","IC8995276","03/03/2023","","9.2","Trash","Create an USC Colorade, Salarie and Biweekly Employee with 9 Digit Tax Area and Married Filing Status.","HCM","AutHubRepo\EOne\9.2\Trash","IC8995276","08","1","","","","false"
1855,"FT_SOE_SS_C41_AssertCancel","SS7654321","03/04/2020","2020/04/03 00:59:59","9.2","Trash","hhh","SOE","\\den01ccp.us.oracle.com\NewScriptBuilderRepo\EOne\9.2\Trash","SS7654321","00","0","","","","false"
1856,"FT_SOE_SS_C33_alertcancel","SS7654321","03/04/2020","2020/04/03 02:45:08","9.2","Trash","jhjk","SOE","\\den01ccp.us.oracle.com\NewScriptBuilderRepo\EOne\9.2\Trash","SS7654321","00","0","","","","false"
1857,"FT_SOE_ss_c51_alertcancel","SS7654321","03/04/2020","2020/04/03 03:12:01","9.2","Trash","jgjg","SOE","\\den01ccp.us.oracle.com\NewScriptBuilderRepo\EOne\9.2\Trash","SS7654321","00","0","","","","false"
1858,"FT_SOE_SS_C61_AssertCancel","SS7654321","03/04/2020","2020/04/03 03:41:21","9.2","Trash","ffss","SOE","\\den01ccp.us.oracle.com\NewScriptBuilderRepo\EOne\9.2\Trash","SS7654321","00","0","","","","false"
1859,"FT_SOE_SS_C54_Login","SS7654321","03/04/2020","2020/04/03 04:16:04","9.2","Trash","sfsd","SOE","\\den01ccp.us.oracle.com\NewScriptBuilderRepo\EOne\9.2\Trash","SS7654321","00","0","","","","false"
1860,"FT_SOE_SS_C55_AlertCancel","SS7654321","03/04/2020","2020/04/03 04:17:35","9.2","Trash","sds","SOE","\\den01ccp.us.oracle.com\NewScriptBuilderRepo\EOne\9.2\Trash","SS7654321","00","0","","","","false"
1862,"FT_SOE_SS_C56_logi","SS7654321","03/04/2020","2020/04/03 04:54:12","9.2","Trash","dfd","SOE","\\den01ccp.us.oracle.com\NewScriptBuilderRepo\EOne\9.2\Trash","SS7654321","00","0","","","","false"
1863,"FT_SOE_SS_C76_Stale","SS7654321","03/04/2020","2020/04/03 05:23:07","9.2","Trash","dfd","SOE","\\den01ccp.us.oracle.com\NewScriptBuilderRepo\EOne\9.2\Trash","SS7654321","00","0","","","","false"
7761,"AppsVersionMissingWithRestAPI","BM9077371","03/04/2023","2023/04/02 22:12:59","9.2","Trash","AppsVersionMissingWithRestAPI","SOE","AutHubRepo\EOne\9.2\Trash","BM9077371","00","0","","","","false"
6157,"sdsds","SS7654321","03/05/2021","2021/05/03 05:36:51","9.2","Trash","cxczx","FMS","AutHubRepo\EOne\9.2\Trash","SS7654321","12","0","","","","false"
6154,"TT_03May_01","SS7654321","03/05/2021","2021/05/02 22:06:18","9.2","Trash","PO","FMS","AutHubRepo\EOne\9.2\Trash","SS7654321","12","0","","","","false"
6155,"TesthhhhhhhhhhhhhhhhhhhhhhhhhhhhTESTRESRdcxzczssda","SS7654321","03/05/2021","2021/05/03 03:39:49","9.2","Trash","dsd","FMS","AutHubRepo\EOne\9.2\Trash","SS7654321","12","0","","","","false"
6161,"FT_SRM_PO_Add_Update_SingleLn_Foreign_SLnTy_STax-Copy(2)","RR9076538","03/05/2021","","9.2","FT","PO Updation","SRM","AutHubRepo\EOne\9.2\FT","PS9074823","43","0","","","","false"
6158,"sdds","SS7654321","03/05/2021","2021/05/03 06:14:37","9.2","Trash","xcxc","CRM","AutHubRepo\EOne\9.2\Trash","SS7654321","12","0","","","","false"
6160,"FT_SOE_sliding rate adjustment P4210-Copy","RR9076538","03/05/2021","","9.2","FT","To verify sliding rate adjustment with Amount and quantity level break in P4210 in ADD and Update modeItem: 96422( Amount level brk)item: 96421( qty level break)QASL: Adjustment scheduleQASL1: QTY level break  Adj NameQASL2  Amount level break Adj NameP4210 |QASOE001","SOE","AutHubRepo\EOne\9.2\FT","SP9073695","45","0","","","","false"
7896,"Generalgrouping_check","SR9078040","03/05/2023","2023/05/03 00:52:13","9.2","Trash","","FMS","AutHubRepo\EOne\9.2\Trash","SR9078040","01","0","","","","false"
3164,"SS_RR_01","SS7654321","03/06/2020","2020/06/02 21:46:06","9.2","Trash","fdf","SOE","AutHubRepo\EOne\9.2\Trash","SS7654321","00","0","","","","false"
3166,"SS_COmma_01","SS7654321","03/06/2020","2020/06/03 00:52:05","9.2","Trash","dsad","SOE","AutHubRepo\EOne\9.2\Trash","SS7654321","00","0","","","","false"
3184,"SS_P4210_GridGrouping_01","SS7654321","03/06/2020","2020/06/03 07:12:36","9.2","Trash","fdf","SOE","AutHubRepo\EOne\9.2\Trash","SS7654321","00","0","","","","false"
3183,"SS_EXTCHR_01","SS7654321","03/06/2020","2020/06/03 06:43:30","9.2","Trash","sds","SOE","AutHubRepo\EOne\9.2\Trash","SS7654321","00","0","","","","false"
3167,"SS_Comma_03","SS7654321","03/06/2020","2020/06/03 00:58:11","9.2","Trash","sds","SOE","AutHubRepo\EOne\9.2\Trash","SS7654321","00","0","","","","false"
3168,"SS_Comma_06","SS7654321","03/06/2020","2020/06/03 01:07:32","9.2","Trash","dsfd","SOE","AutHubRepo\EOne\9.2\Trash","SS7654321","00","0","","","","false"
3169,"SS_Comma_07","SS7654321","03/06/2020","2020/06/03 01:14:24","9.2","Trash","sds","SOE","AutHubRepo\EOne\9.2\Trash","SS7654321","03B","0","","","","false"
3170,"SS_COmon_08","SS7654321","03/06/2020","2020/06/03 01:27:37","9.2","Trash","sds","SOE","AutHubRepo\EOne\9.2\Trash","SS7654321","00","0","","","","false"
3172,"SS_Comon_011","SS7654321","03/06/2020","2020/06/03 01:36:19","9.2","Trash","ddf","SOE","AutHubRepo\EOne\9.2\Trash","SS7654321","00","0","","","","false"
3173,"SS_C_01","SS7654321","03/06/2020","2020/06/03 01:49:35","9.2","Trash","hfh","SOE","AutHubRepo\EOne\9.2\Trash","SS7654321","00","0","","","","false"
3175,"SS_AC_01","SS7654321","03/06/2020","2020/06/03 02:05:35","9.2","Trash","jgjg","SOE","AutHubRepo\EOne\9.2\Trash","SS7654321","01","0","","","","false"
3177,"SS_RRISS_01","SS7654321","03/06/2020","2020/06/03 04:04:06","9.2","Trash","sds","SOE","AutHubRepo\EOne\9.2\Trash","SS7654321","00","0","","","","false"
3179,"SS_AC_02","SS7654321","03/06/2020","2020/06/03 04:34:24","9.2","Trash","sds","SOE","AutHubRepo\EOne\9.2\Trash","SS7654321","01","0","","","","false"
3180,"SS_AC_03","SS7654321","03/06/2020","2020/06/03 04:59:20","9.2","Trash","dsd","SOE","AutHubRepo\EOne\9.2\Trash","SS7654321","00","0","","","","false"
3182,"SS_ALERTCheck_03","SS7654321","03/06/2020","2020/06/03 05:38:30","9.2","Trash","sda","SOE","AutHubRepo\EOne\9.2\Trash","SS7654321","00","0","","","","false"
6284,"FT_SRM_Review comments test KVK","VK9076634","03/06/2021","2021/06/03 02:28:01","9.2","FT","Test","SRM","AutHubRepo\EOne\9.2\FT","VK9076634","00","0","","","","false"
6961,"FT_HCM_BUG33959905 P08330 END STATUS","PY9072027","03/06/2022","2022/06/03 06:35:36","9.2","FT","BUG33959905 P08330 WHEN CREATING NEW ENROLLMENT WITH START AND STOP END STATUS DOES NOT SAVE","HCM","AutHubRepo\EOne\9.2\FT","PY9072027","08B","0","","","","false"
6960,"FT_MFG_A4_PS","PS9056588","03/06/2022","2022/06/03 04:07:39","9.2","Trash","","MFG","AutHubRepo\EOne\9.2\Trash","PS9056588","31B","0","","","","false"
3742,"SS_CREDEMO_01","SS7654321","03/07/2020","2020/07/03 00:25:38","9.2","Trash","ds","SOE","AutHubRepo\EOne\9.2\Trash","SS7654321","12","0","","","","false"
3743,"SS_DEM_02","SS7654321","03/07/2020","2020/07/03 00:34:16","9.2","Trash","sds","SOE","AutHubRepo\EOne\9.2\Trash","SS7654321","32","0","","","","false"
3745,"SS_OFORMTest_01","SS7654321","03/07/2020","2020/07/03 03:44:27","9.2","Trash","er","SOE","AutHubRepo\EOne\9.2\Trash","SS7654321","03B","0","","","","false"
3746,"SS_VMTEST_01","SS7654321","03/07/2020","2020/07/03 04:22:11","9.2","Trash","sds","SOE","AutHubRepo\EOne\9.2\Trash","SS7654321","12","0","","","","false"
7054,"test712","SP9077688","03/07/2022","2022/07/03 23:18:18","9.2","Trash","","CRM","AutHubRepo\EOne\9.2\Trash","SP9077688","01","0","","","","false"
8091,"orc_test1","SR9078040","03/07/2023","2023/07/03 03:50:18","9.2","Trash","","FMS","AutHubRepo\EOne\9.2\Trash","SR9078040","00","1","","","","false"
8092,"Test_Orch001","BM9077371","03/07/2023","2023/07/03 06:29:03","9.2","Trash","","FMS","AutHubRepo\EOne\9.2\Trash","BM9077371","00","0","","","","false"
8093,"Test_Orchestrator_Latest_001","BM9077371","03/07/2023","2023/07/03 21:54:09","9.2","Trash","","FMS","AutHubRepo\EOne\9.2\Trash","BM9077371","00","0","","","","false"
9011,"FT_SOE_QA_35681970_ForeignBlanketRelease","SS9070540","03/07/2024","2024/07/03 01:59:38","9.2","FT","","SOE","AutHubRepo\EOne\9.2\FT","SS9070540","42","0","MY9077944","8-7-2024","07/09/2024","false"
3989,"FT_MFG_OverIssue_StdTimeUpdateforB3only_NoScrap_NoCompl_MultipleWOs","PS9056588","03/08/2020","","9.2","Trash","For  MFG WO,Perform Under issue, Enter std Time entry for labour,machine and setup,No Scrap,No completion.Verify the values in P31022 Production cost inquiry.","MFG","AutHubRepo\EOne\9.2\Trash","IC8871610","31A","0","SP9077688","","","false"
3990,"FT_MFG_STDIssue_UnderTimeSetup_Scrap_STDCompletion_MultipleWO","SL9077266","03/08/2020","","9.2","FT","Validate R31802A for standard Issue, Under Time Update for Setup only, with Scrap and STD completions","MFG","AutHubRepo\EOne\9.2\FT","SL9077266","31A","0","SP9077688","5-7-2021","08/31/2021","false"
3991,"FT_MFG_OverIssue_UnderTimeUpdateforB3only_NoScrap_NoCompl_MultipleWOs","PS9056588","03/08/2020","","9.2","Trash","For  MFG WO,Perform Under issue, Enter std Time entry for labour,machine and setup,No Scrap,No completion.Verify the values in P31022 Production cost inquiry.","MFG","AutHubRepo\EOne\9.2\Trash","IC8871610","31A","0","","","","false"
3992,"FT_MFG_OverIssue_OverTimeUpdateforB3only_NoScrap_NoCompl_MultipleWOs","PS9056588","03/08/2020","","9.2","Trash","For  MFG WO,Perform Under issue, Enter std Time entry for labour,machine and setup,No Scrap,No completion.Verify the values in P31022 Production cost inquiry.","MFG","AutHubRepo\EOne\9.2\Trash","IC8871610","31A","0","","","","false"
3993,"FT_MFG_NoIssue_StdForL,M,STime_ScrapYes_UnderCompletion_MultipleWO","IC8871610","03/08/2020","","9.2","FT","","MFG","AutHubRepo\EOne\9.2\FT","IC8871610","31A","0","FQ1234567","08/29/2021","08/31/2021","false"
3995,"FT_MFG_NoIssue_StdForL,M,STime_ScrapYes_NoCompletion_MultipleWO","IC8871610","03/08/2020","","9.2","FT","","MFG","AutHubRepo\EOne\9.2\FT","IC8871610","31A","0","FQ1234567","08/04/2021","08/31/2021","false"
3996,"FT_SRM_PO_Add_SingleLn_Dom_JSBLnTy_STax_AccDist","PS9074823","03/08/2020","","9.2","FT","","SRM","AutHubRepo\EOne\9.2\FT","PS9074823","43","0","SD9077442","5-7-2021","08/31/2021","false"
3997,"FT_FMS_FixedAssets_AAI_SetUp","AP9076327","03/08/2020","2020/08/03 22:03:06","9.2","FT","This scripts crosschecks whether the required AAI are set up for default company 00000","FMS","AutHubRepo\EOne\9.2\FT","AP9076327","12","0","","","","false"
3998,"FT_FMS_FixedAssets_UserDefinedDepreciation_AAI","AP9076327","03/08/2020","2020/08/03 22:18:09","9.2","FT","This script checks the user defined depreciation AAI","FMS","AutHubRepo\EOne\9.2\FT","AP9076327","12","0","","","","false"
4004,"FT_MFG_NoIssue_StdForL,M,STime_ScrapYes_OverCompletion_MultipleWO","IC8871610","03/08/2020","","9.2","FT","","MFG","AutHubRepo\EOne\9.2\FT","IC8871610","31A","0","CS9076571","22/04/2021","08/31/2021","false"
4005,"FT_MFG_NoIssue_StdForL,M,STime_ScrapYes_StdCompletion_MultipleWO","IC8871610","03/08/2020","","9.2","FT","","MFG","AutHubRepo\EOne\9.2\FT","IC8871610","31A","0","PG9076925","5-7-2021","08/31/2021","false"
7131,"TestBeta","VK9076634","03/08/2022","2022/08/03 06:21:35","9.2","Trash","Beta test","SRM","AutHubRepo\EOne\9.2\Trash","VK9076634","00","1","","","","false"
8344,"FT_HCM_Payroll_TaxValidation-Copy","BV9077354","03/08/2023","","9.2","Trash","The Script verifies tax amounts for Connecticut, Idaho, Maryland, Missouri, Oregon, Pennsylvania, Wisconsin.","HCM","AutHubRepo\EOne\9.2\Trash","BV9077354","07","0","","","","false"
8336,"SS_03AUG_23","SS7654321","03/08/2023","2023/08/03 00:38:53","9.2","Trash","sdsds","FMS","AutHubRepo\EOne\9.2\Trash","SS7654321","03B","0","","","","false"
8330,"SS_03AUG_01","SS7654321","03/08/2023","2023/08/02 20:45:33","9.2","Trash","ORC","FMS","AutHubRepo\EOne\9.2\Trash","SS7654321","01","1","","","","false"
8333,"SS_03AUG_02","SS7654321","03/08/2023","2023/08/03 00:24:02","9.2","Trash","ORC","FMS","AutHubRepo\EOne\9.2\Trash","SS7654321","12","0","","","","false"
8341,"FT_HCM_Payroll_TaxValidation","BV9077354","03/08/2023","2023/08/03 22:17:06","9.2","Trash","The Script verifies tax amounts for Connecticut, Idaho, Maryland, Missouri, Oregon, Pennsylvania, Wisconsin.","HCM","AutHubRepo\EOne\9.2\Trash","BV9077354","07","0","","","","false"
4768,"py test","PY9072027","03/09/2020","2020/09/02 23:54:57","9.2","Trash","","HCM","AutHubRepo\EOne\9.2\Trash","PY9072027","07","0","","","","false"
4781,"FT_SRM_Amt.Level adjustment with Foreign Supplier with P43090 cost, Auto reprice ON","PS9074823","03/09/2020","","9.2","FT","","SRM","AutHubRepo\EOne\9.2\FT","PS9074823","43","0","VK9076634","20-5-2021","08/31/2021","false"
4780,"FT_SRM_Amt.Level adjustment with Foreign Supplier,Auto reprice ON","PS9074823","03/09/2020","","9.2","FT","","SRM","AutHubRepo\EOne\9.2\FT","PS9074823","43","0","VK9076634","20-5-2021","08/31/2021","false"
4777,"FT_FMS_FA_ProcessingOptions_R12910","AP9076327","03/09/2020","","9.2","FT","Script to set up processing options for P1204","FMS","AutHubRepo\EOne\9.2\FT","AP9076327","12","0","","","","false"
4776,"FT_FMS_FA_ProcessingOptions_R12823","AP9076327","03/09/2020","","9.2","FT","Script to set up processing options for P1204","FMS","AutHubRepo\EOne\9.2\FT","AP9076327","12","0","","","","false"
4769,"FT_HCM_FT_HCM_FLEXPLANELECTION_P08334","IC8999058","03/09/2020","2020/09/03 03:00:29","9.2","Trash","","HCM","AutHubRepo\EOne\9.2\Trash","IC8999058","08B","0","SP9077688","","08/31/2021","false"
4779,"FT_HCM_batch Enrollment for Mandatory and default Plan","AA9055665","03/09/2020","2020/09/03 05:54:37","9.2","FT","Batch enrollment for Mandatory and default plans.","HCM","AutHubRepo\EOne\9.2\FT","AA9055665","08B","0","SD9077442","20-5-2021","08/31/2021","false"
6593,"Test Khias","IC9016551","03/09/2021","2021/09/03 06:09:09","9.2","Trash","","SRM","AutHubRepo\EOne\9.2\Trash","IC9016551","43B","0","","","","false"
6592,"kia01","SS7654321","03/09/2021","2021/09/03 03:46:36","9.2","Trash","ty","FMS","AutHubRepo\EOne\9.2\Trash","SS7654321","12","0","","","","false"
6595,"kias1201","SS7654321","03/09/2021","2021/09/03 05:27:37","9.2","Trash","xczx","CRM","AutHubRepo\EOne\9.2\Trash","SS7654321","01","0","","","","false"
6594,"Test Khias1","IC9016551","03/09/2021","2021/09/03 06:10:58","9.2","Trash","Test Khias ","SRM","AutHubRepo\EOne\9.2\Trash","IC9016551","43B","0","","","","false"
6591,"FT_SRM_DeleteLoggedVoucherReady to Match PT2 POis Blank1","IC9016551","03/09/2021","2021/09/03 00:48:57","9.2","FT","","SRM","AutHubRepo\EOne\9.2\FT","IC9016551","43B","0","","","","false"
6596,"Khias Test Recorded Script","IC9016551","03/09/2021","2021/09/03 06:38:10","9.2","Trash","Khias Test Script","SRM","AutHubRepo\EOne\9.2\Trash","IC9016551","43B","0","","","","false"
6597,"kisa9090","SS7654321","03/09/2021","2021/09/03 05:44:53","9.2","Trash","czx","FMS","AutHubRepo\EOne\9.2\Trash","SS7654321","12","0","","","","false"
7230,"FT_HCM_BUG33788918 P07620 LEAVE REQUEST WILL NOT LOAD DIS","PY9072027","03/10/2022","2022/10/03 01:53:03","9.2","Trash","BUG33788918 P07620 LEAVE REQUEST WILL NOT LOAD DISPLAYS GATEWAY 502 TIMEOUT ERROR","HCM","AutHubRepo\EOne\9.2\Trash","PY9072027","07","0","","","","false"
8606,"FT_FMS_1099 INT using GL method","IC8735933","03/10/2023","","9.2","FT","1099 INT using GL method- End to End Process","FMS","AutHubRepo\EOne\9.2\FT","IC8735933","04","0","NK9071139","8-11-2023","11/16/2023","false"
8611,"FT_SRM_Volume_Based_Buying_P4310_Dom_For_Curr","SM9073222","03/10/2023","2023/10/03 04:59:46","9.2","FT","","SRM","AutHubRepo\EOne\9.2\FT","SM9073222","43","0","","","","false"
8612,"FT_SRM_Volume_Based_Buying_P43101_Dom_For_Curr","SM9073222","03/10/2023","2023/10/03 08:58:21","9.2","FT","Volume Based Buying Advanced Pricing feature for Procurement using P43101 application.","SRM","AutHubRepo\EOne\9.2\FT","SM9073222","43","0","","","","false"
5142,"FT_MFG_STDCost_STDIssue_Labor_OverCompletion_MultipleWO-Copy","SS7654321","03/11/2020","","9.2","Trash","Validate R31802A for standard Issue, Standard Time Update for labor only, over completions","MFG","AutHubRepo\EOne\9.2\Trash","SL9077266","31A","0","","","","false"
5133,"FT_MFG_STDCost_STDIssue_UnderTimeLabor_UnderComp_MultipleWO-Copy","RR9076538","03/11/2020","","9.2","Trash","Validate R31802A for standard Issue, under Time Update for labor only, under completions","MFG","AutHubRepo\EOne\9.2\Trash","SL9077266","31A","0","","","","false"
5139,"FT_SOE_AOP_Copy_Many_01","IC8838633","03/11/2020","","9.2","FT","Adjustment Schedule = QAOL
Item group - Customer QAIG1 - 53301 971181 - 53301 100 USD 110 CAD
Item group - Customer group QAIG1 - QACG 971181 - 53303 200 USD 210 CAD 
Item group only QAIG2 971190 300 USD 310 CAD
  R42750|QAOL2 All PO blank
R42750|QAOL1 All PO non-blank 
P4210|QAOL003 Preserve FG 
P4210|QAOL003

SO: 7229./7230
","SOE","AutHubRepo\EOne\9.2\FT","IC8838633","45","0","IC8823870","24-8-2021","11/15/2021","false"
5141,"FT_HCM_To end enrollment for the terminated Employee","BV9077354","03/11/2020","2020/11/03 19:05:04","9.2","FT","Terminates an employee and stops the plans elected.","HCM","AutHubRepo\EOne\9.2\FT","BV9077354","08B","0","SP9077688","16-7-2021","08/31/2021","false"
5135,"FT_FMS_Foreign Invoice with Multiple Pay Item","PN9077426","03/11/2020","2020/11/03 07:56:14","9.2","FT","This Script is for request id 19605","FMS","AutHubRepo\EOne\9.2\FT","PN9077426","03B","1","","","","false"
5137,"FT_SOE_AOP_Copy_Once_01","IC8838633","03/11/2020","2020/11/03 09:26:08","9.2","FT","Adjustment Schedule = QAOL
Item group - Customer QAIG1 - 53301 971181 - 53301 100 USD 110 CAD
Item group - Customer group QAIG1 - QACG 971181 - 53303 200 USD 210 CAD 
Item group only QAIG2 971190 300 USD 310 CAD
  R42750|QAOL2 All PO blank
R42750|QAOL1 All PO non-blank 
P4210|QAOL003 Preserve FG 
P4210|QAOL003

SO: 7229./7230
","SOE","AutHubRepo\EOne\9.2\FT","IC8838633","45","0","IC8823870","24-8-2021","11/15/2021","false"
6698,"FT_MFG_A9BlendScenario1","DG9077207","03/11/2021","2021/11/03 03:47:23","9.2","FT","A9 Blend Scenario 1<br>Steps	Expected Behaviour<br>1.Select the set of operations	<br>GWT,CW2V,D2T,T2T,RECV,R2T,T2T1,T2T2,ADDV,T2B,B2B,ADDB,B2T,ADJLOT, BOTT,TANKMT,SHIPV,TRANS,RECTRANS,T2T,DECLOSS,ADJINV,SHIPFULLTNK	<br>""2. Perform Action dropdown to Speed Actuals. Change the status to<br> CLOSED using Speed Actuals.""	Control goes back to P31B94<br>3.Veirfy the table values	""F31B65,F31b70,F31B71,F31B31,<br>F31B31C,F31B66,F4111  - for item associated to block, equipments and consumables.""<br>"" 3. Without clicking on find, select the set of operations <br> again and perform action dropdown to speed actuals. ""	User should not be able to do this. Verify that Speed Actuals option & Speed Updates option is not displayed in the action dropdown.<br>	<br>	<br> Expected behavior: 	<br> Should not be able to close the Operation more than once 	<br> with using Speed Actuals 	","MFG","AutHubRepo\EOne\9.2\FT","DG9077207","31B","0","","","","false"
7282,"FT_HCM_Bug_34238887_125DbaTesting-Copy","AS9077848","03/11/2022","","9.2","FT","A section of bug","HCM","AutHubRepo\EOne\9.2\FT","AS9077848","07","1","","","","false"
7281,"FT_HCM_Bug_testInterim","AS9077848","03/11/2022","2022/11/03 04:28:30","9.2","FT","A section","HCM","AutHubRepo\EOne\9.2\FT","AS9077848","07","1","","","","false"
5426,"FT_MFG_R31804_STDIssue_STDUpdateforL,M,S_ScrapNo_STDCompletion_MultipleWO","SL9077266","03/12/2020","","9.2","FT","Validate R31804 for standard Issue, Standard Time Update for labor, Machine and Setup, without Scrap and Standard completions","MFG","AutHubRepo\EOne\9.2\FT","SL9077266","31A","0","FQ1234567","","08/31/2021","false"
5531,"Test01","SS7654321","04/01/2021","2021/01/04 22:59:44","9.2","Trash","Test01","FMS","AutHubRepo\EOne\9.2\Trash","SS7654321","12","0","","","","false"
5533,"myTest","SD9077442","04/01/2021","2021/01/04 23:15:22","9.2","Trash","","FMS","AutHubRepo\EOne\9.2\Trash","SD9077442","09","0","","","","false"
5528,"encode_Check","PG9076925","04/01/2021","2021/01/04 03:14:42","9.2","Trash","","FMS","AutHubRepo\EOne\9.2\Trash","PG9076925","00","0","","","","false"
5534,"myTest-Copy","SD9077442","04/01/2021","","9.2","Trash","","FMS","AutHubRepo\EOne\9.2\Trash","SD9077442","09","0","","","","false"
5532,"Test02","SS7654321","04/01/2021","2021/01/04 23:11:35","9.2","Trash","test01","FMS","AutHubRepo\EOne\9.2\Trash","SS7654321","01","0","","","","false"
6744,"WRT_Testing-4","MO9077792","04/01/2022","2022/01/04 07:08:21","9.2","Trash","","Tools","AutHubRepo\EOne\9.2\Trash","MO9077792","01","0","","","","true"
6742,"WRT_Test0301","SP9077688","04/01/2022","2022/01/04 06:09:14","Tools","Trash","Testing installer 2.0.6","Tools","AutHubRepo\EOne\Tools\Trash","SP9077688","00","0","","","","false"
1327,"FT_SOE_SOCreateDemo","SS7654321","04/02/2020","2020/02/04 01:59:03","9.2","Trash","SOCreateDemo","SOE","\\den01ccp.us.oracle.com\NewScriptBuilderRepo\EOne\9.2\Trash","SS7654321","42","0","","","","false"
1328,"FT_SOE_PLScriptingDeamo","SS7654321","04/02/2020","2020/02/04 02:11:19","9.2","Trash","PlScriptingDemo","SOE","\\den01ccp.us.oracle.com\NewScriptBuilderRepo\EOne\9.2\Trash","SS7654321","42","0","","","","false"
1325,"FT_SOE_SOE1","SS7654321","04/02/2020","2020/02/04 00:36:15","9.2","Trash","SOE1","SOE","\\den01ccp.us.oracle.com\NewScriptBuilderRepo\EOne\9.2\Trash","SS7654321","42","0","","","","false"
1326,"FT_SOE_SOE2","SS7654321","04/02/2020","2020/02/04 00:37:29","9.2","Trash","SOE2","SOE","\\den01ccp.us.oracle.com\NewScriptBuilderRepo\EOne\9.2\Trash","SS7654321","42","0","","","","false"
5761,"CreateItem2","IC8838633","04/02/2021","2021/02/03 23:16:34","9.2","Trash","P4101
Create an item and verify the item created.","SOE","AutHubRepo\EOne\9.2\Trash","IC8838633","41","0","","","","false"
5758,"Rest_51","VK9076634","04/02/2021","2021/02/03 21:05:27","9.2","Trash","Test","SRM","AutHubRepo\EOne\9.2\Trash","VK9076634","00","0","","","","false"
5764,"CRM_CRM_05_Foundation","RR9076538","04/02/2021","2021/02/04 02:24:43","9.2","BPF","test","CRM","AutHubRepo\EOne\9.2\BPF","RR9076538","08","0","","","","false"
5763,"CreateItem3","IC8838633","04/02/2021","2021/02/03 23:34:54","9.2","Trash","Create an item and verify the item created successfully.","SOE","AutHubRepo\EOne\9.2\Trash","IC8838633","41","0","","","","false"
5757,"TestCoding","VK9076634","04/02/2021","2021/02/03 20:58:30","9.2","Trash","Test","SRM","AutHubRepo\EOne\9.2\Trash","VK9076634","00","0","","","","false"
5760,"FT_SOM_Create_Item","IC8838633","04/02/2021","2021/02/03 21:55:07","9.2","Trash","Create an item in P4101.","SOE","AutHubRepo\EOne\9.2\Trash","IC8838633","41","0","","","","false"
5759,"Trest","VK9076634","04/02/2021","2021/02/03 21:13:24","9.2","Trash","Test","SRM","AutHubRepo\EOne\9.2\Trash","VK9076634","00","0","","","","false"
1576,"FT_SOE_SS_NLP1","SS7654321","04/03/2020","2020/03/04 20:54:29","9.2","Trash","NLP1","SOE","\\den01ccp.us.oracle.com\NewScriptBuilderRepo\EOne\9.2\Trash","SS7654321","42","0","","","","false"
5869,"CRM_test_03","RR9076538","04/03/2021","2021/03/04 07:43:36","9.2","BPF","","CRM","AutHubRepo\EOne\9.2\BPF","RR9076538","08B","0","","","","false"
8806,"FT_HCM_TaxAmounts_Verification1","BV9077354","04/03/2024","","9.2","Trash","US states Tax amounts and YTD taxes verification","HCM","AutHubRepo\EOne\9.2\Trash","BV9077354","07","0","","","","false"
8807,"FT_HCM_TAXVERIFICATION2","BV9077354","04/03/2024","","9.2","FT","","HCM","AutHubRepo\EOne\9.2\FT","AS9077848","07","0","","","","false"
1877,"FT_SRM_Apply Standalone LC BUG30857593","IC9016551","04/04/2020","","9.2","FT","null","SRM","\\den01ccp.us.oracle.com\NewScriptBuilderRepo\EOne\9.2\FT","IC9016551","43B","0","","","","false"
1875,"FT_SRM_Apply Standalone LC - BUG#30857593","IC9016551","04/04/2020","2020/04/04 09:16:49","9.2","FT","","SRM","\\den01ccp.us.oracle.com\NewScriptBuilderRepo\EOne\9.2\FT","IC9016551","43B","0","","","","false"
5904,"FT_HCM_ReviewTest","CS9076571","04/04/2021","2021/04/04 08:12:06","9.2","FT","","HCM","AutHubRepo\EOne\9.2\FT","CS9076571","07","0","CS9076571","06/04/2021","06/04/2021","false"
7763,"FT_FMS_Edit a posted invoice to add a pay item and post","IC8735933","04/04/2023","2023/04/03 19:36:48","9.2","FT","Edit a posted invoice to add a pay item and post","FMS","AutHubRepo\EOne\9.2\FT","IC8735933","03B","0","RK9078162","12-4-2023","04/12/2023","false"
7766,"FT_FMS_Edit an unposted foreign invoice","IC8735933","04/04/2023","2023/04/03 20:14:23","9.2","FT","Edit an unposted foreign invoice","FMS","AutHubRepo\EOne\9.2\FT","IC8735933","03B","0","RK9078162","13-4-2023","04/14/2023","false"
7767,"FT_FMS_Add a Credit Memo and post","IC8735933","04/04/2023","2023/04/03 20:16:43","9.2","FT","Add a Credit Memo and post","FMS","AutHubRepo\EOne\9.2\FT","IC8735933","03B","0","RK9078162","13-4-2023","04/14/2023","false"
7764,"FT_FMS_Edit unposted invoice and post","IC8735933","04/04/2023","2023/04/03 19:41:18","9.2","FT","Edit unposted invoice and post","FMS","AutHubRepo\EOne\9.2\FT","IC8735933","03B","0","RK9078162","13-4-2023","04/14/2023","false"
7765,"FT_FMS_Edit a Posted Foreign Invoice","IC8735933","04/04/2023","2023/04/03 20:11:32","9.2","FT","Edit a Posted Foreign Invoice","FMS","AutHubRepo\EOne\9.2\FT","IC8735933","03B","0","RK9078162","12-4-2023","04/12/2023","false"
2678,"FT_SOE_SS_RIT_03M_094","SS7654321","04/05/2020","2020/05/04 04:38:37","9.2","Trash","dfdf","SOE","AutHubRepo\EOne\9.2\Trash","SS7654321","00","0","","","","false"
2667,"FT_SOE_SS_GRREF_04M","SS7654321","04/05/2020","2020/05/04 00:25:54","9.2","Trash","sdff","SOE","AutHubRepo\EOne\9.2\Trash","SS7654321","00","0","","","","false"
2666,"FT_SOE_SS_04M_GriChe2","SS7654321","04/05/2020","2020/05/04 00:05:35","9.2","Trash","hjh","SOE","AutHubRepo\EOne\9.2\Trash","SS7654321","00","0","","","","false"
2664,"FT_SOE_SS_04M_02_GridRefre","SS7654321","04/05/2020","2020/05/03 23:19:45","9.2","Trash","hghg","SOE","AutHubRepo\EOne\9.2\Trash","SS7654321","00","0","","","","false"
2663,"FT_SOE_SS_04M_01","SS7654321","04/05/2020","2020/05/03 23:11:18","9.2","Trash","sds","SOE","AutHubRepo\EOne\9.2\Trash","SS7654321","00","0","","","","false"
2679,"FT_SOE_SS_09joi","SS7654321","04/05/2020","2020/05/04 06:03:05","9.2","Trash","dfd","SOE","AutHubRepo\EOne\9.2\Trash","SS7654321","00","0","","","","false"
2681,"FT_SOE_Ss-NEWCLick_01","SS7654321","04/05/2020","2020/05/04 08:38:33","9.2","Trash","sds","SOE","AutHubRepo\EOne\9.2\Trash","SS7654321","03B","0","","","","false"
2680,"FT_SOE_ss_RT_0988","SS7654321","04/05/2020","2020/05/04 06:08:03","9.2","Trash","g","SOE","AutHubRepo\EOne\9.2\Trash","SS7654321","00","0","","","","false"
2673,"FT_SOE_SS_BRNI_01M_03","SS7654321","04/05/2020","2020/05/04 03:41:54","9.2","Trash","dfd","SOE","AutHubRepo\EOne\9.2\Trash","SS7654321","01","0","","","","false"
2671,"FT_SOE_SS_BRNI_04M_01","SS7654321","04/05/2020","2020/05/04 03:28:00","9.2","Trash","fdf","SOE","AutHubRepo\EOne\9.2\Trash","SS7654321","00","0","","","","false"
2675,"FT_SOE_FT_RIT_03M_034","SS7654321","04/05/2020","2020/05/04 03:55:33","9.2","Trash","dfdf","SOE","AutHubRepo\EOne\9.2\Trash","SS7654321","00","0","","","","false"
2676,"FT_SOE_SS_RIT_03M_090","SS7654321","04/05/2020","2020/05/04 04:19:59","9.2","Trash","fdg","SOE","AutHubRepo\EOne\9.2\Trash","SS7654321","00","0","","","","false"
6167,"ut_pls","SD9077442","04/05/2021","2021/05/04 08:04:43","9.2","Trash","1","FMS","AutHubRepo\EOne\9.2\Trash","SD9077442","01","0","","","","false"
6162,"terre","SS7654321","04/05/2021","2021/05/04 00:06:55","9.2","Trash","cxxc","FMS","AutHubRepo\EOne\9.2\Trash","SS7654321","12","0","","","","false"
6163,"Test012","VK9076634","04/05/2021","2021/05/04 00:54:32","9.2","Trash","Test 01","SRM","AutHubRepo\EOne\9.2\Trash","VK9076634","00","0","","","","false"
6913,"FMS_working","VK9075359","04/05/2022","","9.2","BPF","test","FMS","AutHubRepo\EOne\9.2\BPF","VK9075359","15","0","","","","false"
7899,"FT_FMS_Update Invoice 1 pitm_Tax by pay item constant On","IC8735933","04/05/2023","2023/05/04 11:12:00","9.2","FT","P03B2002|QAZJDE0001<br>Update Invoice single pay item with Tax by pay item constant On and post","FMS","AutHubRepo\EOne\9.2\FT","IC8735933","03B","0","IC8823870","12-5-2023","05/21/2023","false"
7897,"FT_FMS_Update 2 line foreign vchr_Tax by Payitm ON","IC8735933","04/05/2023","2023/05/03 12:47:31","9.2","FT","P0411|QAZJDE0001 - Update foreign voucher multiple pay item with Tax by pay item On and post","FMS","AutHubRepo\EOne\9.2\FT","IC8735933","04","0","IC8823870","12-5-2023","05/21/2023","false"
7898,"FT_HCM_BUG35028825","IC8995276","04/05/2023","2023/05/04 06:39:33","9.2","Trash","This script is to validate issue specified in the bug 35028825. Refer the test cases of that bug for more information.","HCM","AutHubRepo\EOne\9.2\Trash","IC8995276","07","0","","","","false"
3200,"ReTest","VK9076634","04/06/2020","2020/06/04 06:43:07","9.2","Trash","Test record","SRM","AutHubRepo\EOne\9.2\Trash","VK9076634","03B","0","","","","false"
3198,"SS_RAVILOgin_02","SS7654321","04/06/2020","2020/06/04 05:34:51","9.2","Trash","fdsf","SOE","AutHubRepo\EOne\9.2\Trash","SS7654321","00","0","","","","false"
3196,"SS_Ravi_01","SS7654321","04/06/2020","2020/06/04 04:57:11","9.2","Trash","dsad","SOE","AutHubRepo\EOne\9.2\Trash","SS7654321","01","0","","","","false"
3193,"SS_RR_03J_01","SS7654321","04/06/2020","2020/06/04 04:07:58","9.2","Trash","sds","SOE","AutHubRepo\EOne\9.2\Trash","SS7654321","01","0","","","","false"
3192,"FT_MFG_June4","RD9076642","04/06/2020","2020/06/04 03:34:33","9.2","Trash","","MFG","AutHubRepo\EOne\9.2\Trash","RD9076642","03B","0","","","","false"
3191,"SS_RR_Sent4ence_03","SS7654321","04/06/2020","2020/06/04 03:32:04","9.2","Trash","fds","SOE","AutHubRepo\EOne\9.2\Trash","SS7654321","00","0","","","","false"
3190,"SS_RR_Sentence_02","SS7654321","04/06/2020","2020/06/04 03:25:52","9.2","Trash","sds","SOE","AutHubRepo\EOne\9.2\Trash","SS7654321","00","0","","","","false"
